sku,description
BSKH63472,Human Eukaryotic Translation Elongation Factor 1 Gamma (EEF1g) ELISA Kit
BSKH63473,Human Ephrin A1 (EFNA1) ELISA Kit
BSKH63474,Human Ephrin A3 (EFNA3) ELISA Kit
BSKH63475,Human Ephrin A4 (EFNA4) ELISA Kit
BSKH63476,Human Ephrin A5 (EFNA5) ELISA Kit
BSKH63477,Human Ephrin B2 (EFNB2) ELISA Kit
BSKH63478,Human Eukaryotic Translation Initiation Factor 4A2 (EIF4A2) ELISA Kit
BSKH63479,Human Elastase 2B (ELA2B) ELISA Kit
BSKH63480,Human Elastase 3A (ELA3A) ELISA Kit
BSKH63481,Human Elastase 3B (ELA3B) ELISA Kit
BSKH63482,Human ELAV Like Protein 1 (ELAVL1) ELISA Kit
BSKH63483,Human Elongation Of Very Long Chain Fatty Acids Like Protein 1 (ELOVL1) ELISA Kit
BSKH63484,Human Elastin Microfibril Interface Located Protein 2 (EMILIN2) ELISA Kit
BSKH63485,Human Epithelial Membrane Protein 3 (EMP3) ELISA Kit
BSKH63486,Human EGF Like Module Containing Mucin Like Hormone Receptor 1 (EMR1) ELISA Kit
BSKH63487,Human Engrailed Homeobox Protein 2 (EN2) ELISA Kit
BSKH63488,"Human Endonuclease G, Mitochondrial (ENDOG) ELISA Kit"
BSKH63489,Human Ectonucleotide Pyrophosphatase/Phosphodiesterase 1 (ENPP1) ELISA Kit
BSKH63490,Human Ectonucleotide Pyrophosphatase/Phosphodiesterase 2 (ENPP2) ELISA Kit
BSKH63491,Human Eomesodermin (EOMES) ELISA Kit
BSKH63492,Human E1A Binding Protein P300 (EP300) ELISA Kit
BSKH63493,Human Ephrin Type A Receptor 10 (EPHA10) ELISA Kit
BSKH63494,Human Ephrin Type A Receptor 3 (EPHA3) ELISA Kit
BSKH63495,"Human Epithelial Stromal Interaction 1, Breast (EPSTI1) ELISA Kit"
BSKH63496,Human Eosinophil Peroxidase (EPX) ELISA Kit
BSKH63497,Human Epiphycan (EPYC) ELISA Kit
BSKH63498,Human Endoplasmic Reticulum Aminopeptidase 2 (ERAP2) ELISA Kit
BSKH63499,Human V-Erb B2 Erythroblastic Leukemia Viral Oncogene Homolog 3 (ErbB3) ELISA Kit
BSKH63500,Human V-Erb A Erythroblastic Leukemia Viral Oncogene Homolog 4 (ErbB4) ELISA Kit
BSKH63501,Human Excision Repair Cross Complementing Rodent Repair Deficiency Complementation 1 (ERCC1) ELISA Kit
BSKR63502,Rat Extracellular Signal Regulated Kinase 1 (ERK1) ELISA Kit
BSKH63503,Human Endoplasmic Reticulum To Nucleus Signaling 1 (ERN1) ELISA Kit
BSKH63504,Human Estrogen Related Receptor Alpha (ERRa) ELISA Kit
BSKH63505,Human Endothelial Cell Adhesion Molecule (ESAM) ELISA Kit
BSKH63506,Human Endothelial Cell Specific Molecule 1 (ESM1) ELISA Kit
BSKH63507,Human Electron Transfer Flavoprotein Alpha Polypeptide (ETFa) ELISA Kit
BSKH63508,Human Electron Transferring Flavoprotein Dehydrogenase (ETFDH) ELISA Kit
BSKH63509,Human Envoplakin (EVPL) ELISA Kit
BSKH63510,Human Exosome Component 2 (EXOSC2) ELISA Kit
BSKH63511,Human Exostoses 1 (EXT1) ELISA Kit
BSKH63512,Human Enhancer Of Zeste Homolog 1 (EZH1) ELISA Kit
BSKH63513,Human Enhancer Of Zeste Homolog 2 (EZH2) ELISA Kit
BSKH63514,Human Fatty Acid Desaturase 1 (FADS1) ELISA Kit
BSKH63515,Human Fatty Acid Desaturase 2 (FADS2) ELISA Kit
BSKH63516,Human Fatty Acid Desaturase 3 (FADS3) ELISA Kit
BSKH63517,Human Fas Apoptotic Inhibitory Molecule 3 (FAIM3) ELISA Kit
BSKH63518,"Human Family With Sequence Similarity 20, Member A (FAM20A) ELISA Kit"
BSKH63519,Human Fibroblast Activation Protein Alpha (FAPa) ELISA Kit
BSKH63520,Human Fatty Acid Synthase (FASN) ELISA Kit
BSKH63521,Human Fatty Acid Transport Protein 1 (FATP1) ELISA Kit
BSKH63522,Human Fatty Acid Transport Protein 4 (FATP4) ELISA Kit
BSKH63523,Human Fibulin 1 (FBLN1) ELISA Kit
BSKH63524,Human Fibulin 2 (FBLN2) ELISA Kit
BSKH63525,Human Fibulin 3 (FBLN3) ELISA Kit
BSKH63526,Human Fibulin 4 (FBLN4) ELISA Kit
BSKH63527,Human Fibulin 5 (FBLN5) ELISA Kit
BSKH63528,Human F-Box Protein 32 (FBXO32) ELISA Kit
BSKH63529,Human Fc Fragment Of IgG Receptor Transporter Alpha (FcgRT) ELISA Kit
BSKH63530,Human Ferrochelatase (FECH) ELISA Kit
BSKH63531,Human Free Fatty Acid Receptor 1 (FFAR1) ELISA Kit
BSKH63532,Human Fibrinogen Gamma (FGg) ELISA Kit
BSKH63533,Human Fibrinogen Like Protein 1 (FGL1) ELISA Kit
BSKH63534,Human Four And A Half LIM Domains Protein 1 (FHL1) ELISA Kit
BSKH63535,Human Fission 1 (FIS1) ELISA Kit
BSKH63536,Human FK506 Binding Protein 1A (FKBP1A) ELISA Kit
BSKH63537,Human FK506 Binding Protein 4 (FKBP4) ELISA Kit
BSKH63538,Human FK506 Binding Protein 5 (FKBP5) ELISA Kit
BSKH63539,Human Folliculin (FLCN) ELISA Kit
BSKH63540,Human Filaggrin (FLG) ELISA Kit
BSKH63541,Human Flightless I Homolog (FLII) ELISA Kit
BSKH63542,Human Filamin A Alpha (FLNa) ELISA Kit
BSKH63543,Human Filamin B Beta (FLNb) ELISA Kit
BSKH63544,Human Filamin C Gamma (FLNC) ELISA Kit
BSKH63545,Human Flotillin 2 (FLOT2) ELISA Kit
BSKH63546,Human Flavin Containing Monooxygenase 1 (FMO1) ELISA Kit
BSKH63547,Human Fragile X Mental Retardation 1 (FMR1) ELISA Kit
BSKH63548,Human Fructosamine-3-Kinase (FN3K) ELISA Kit
BSKH63549,Human Formin Binding Protein 1 (FNBP1) ELISA Kit
BSKH63550,"Human Folate Receptor 1, Adult (FOLR1) ELISA Kit"
BSKH63551,"Human Folate Receptor 2, Adult (FOLR2) ELISA Kit"
BSKH63552,Human Ferroportin (FPN) ELISA Kit
BSKH63553,Human Frizzled Related Protein (FRZB) ELISA Kit
BSKH63554,Human Follicle Stimulating Hormone Receptor (FSHR) ELISA Kit
BSKH63555,Human Fibrous Sheath Interacting Protein 1 (FSIP1) ELISA Kit
BSKH63556,Human Follistatin Like Protein 1 (FSTL1) ELISA Kit
BSKH63557,"Human Ferritin, Heavy Polypeptide (FTH) ELISA Kit"
BSKH63558,"Human Ferritin, Light Polypeptide (FTL) ELISA Kit"
BSKH63559,"Human Ferritin, Mitochondrial (FTMT) ELISA Kit"
BSKH63560,"Human Fucosidase Alpha L2, Plasma (FUCa2) ELISA Kit"
BSKH63561,Human Furin (FUR) ELISA Kit
BSKH63562,Human Fusion (FUS) ELISA Kit
BSKH63563,Human Fucosyltransferase 6 (FUT6) ELISA Kit
BSKH63564,Human Farnesoid X Receptor (FXR) ELISA Kit
BSKH63565,Human FYN Oncogene Related To SRC/FGR/YES (FYN) ELISA Kit
BSKH63566,Human Frizzled Homolog 1 (FZD1) ELISA Kit
BSKH63567,Human Frizzled Homolog 6 (FZD6) ELISA Kit
BSKH63568,"Human Glucose-6-Phosphatase, Catalytic (G6PC) ELISA Kit"
BSKH63569,Human GA Binding Protein Transcription Factor Alpha (GABPa) ELISA Kit
BSKH63570,Human Gamma-Aminobutyric Acid A Receptor Alpha 2 (gABRa2) ELISA Kit
BSKH63571,"Human Glutamate Decarboxylase 1, Brain (GAD1) ELISA Kit"
BSKH63572,Human Galactose-1-Phosphate Uridylyltransferase (GALT) ELISA Kit
BSKH63573,Human Gigaxonin (GAN) ELISA Kit
BSKH63574,Human Glycyl tRNA Synthetase (GARS) ELISA Kit
BSKH63575,"Human Glucosidase Beta, Acid (GbA) ELISA Kit"
BSKH63576,Human Guanine Deaminase (GDA) ELISA Kit
BSKH63577,Human Growth Differentiation Factor 11 (GDF11) ELISA Kit
BSKH63578,Human Growth Differentiation Factor 15 (GDF15) ELISA Kit
BSKH63579,Human Growth Differentiation Factor 1 (GDF1) ELISA Kit
BSKH63580,Human Growth Differentiation Factor 3 (GDF3) ELISA Kit
BSKH63581,Human Glutamine Fructose-6-Phosphate Transaminase 2 (GFPT2) ELISA Kit
BSKH63582,Human Gamma-Glutamyl Hydrolase (gGH) ELISA Kit
BSKH63583,Human Gamma-Glutamyltransferase 5 (gGT5) ELISA Kit
BSKH63584,Human Growth Hormone 2 (GH2) ELISA Kit
BSKH63585,Human Growth Hormone Secretagogue Receptor (GHSR) ELISA Kit
BSKH63586,Human Gastric Intrinsic Factor (GIF) ELISA Kit
BSKH63587,Human Gap Junction Protein Beta 1 (GJb1) ELISA Kit
BSKH63588,Human Gastrokine 1 (GKN1) ELISA Kit
BSKH63589,Human Gastrokine 2 (GKN2) ELISA Kit
BSKH63590,Human Glycine Dehydrogenase (GLDC) ELISA Kit
BSKH63591,Human GLI Family Zinc Finger Protein 1 (GLI1) ELISA Kit
BSKH63592,Human Glutamine synthetase (GS) ELISA Kit
BSKH63593,Human Glyoxalase I (GLO1) ELISA Kit
BSKH63594,Human Glucagon Like Peptide 1 Receptor (GLP1R) ELISA Kit
BSKH63595,Human Glucagon Like Peptide 2 (GLP2) ELISA Kit
BSKH63596,Human Glutaredoxin 3 (GLRX3) ELISA Kit
BSKH63597,Human Glutaredoxin (GLRX) ELISA Kit
BSKH63598,Human Glutaminase (GLS) ELISA Kit
BSKH63599,Human Glucose Transporter 2 (GLUT2) ELISA Kit
BSKH63600,Human Glucose Transporter 4 (GLUT4) ELISA Kit
BSKH63601,Human Glycine Transporter 1 (GLYT1) ELISA Kit
BSKH63602,Human Glycosylphosphatidylinositol Anchored Molecule Like Protein (GML) ELISA Kit
BSKH63603,Human G Protein Alpha Inhibiting Activity Polypeptide 3 (GNaI3) ELISA Kit
BSKH63604,Human Glycine-N-Methyltransferase (GNMT) ELISA Kit
BSKH63605,Human Glycoprotein A33 (GPA33) ELISA Kit
BSKH63606,"Human Glycerol-3-Phosphate Acyltransferase, Mitochondrial (GPAM) ELISA Kit"
BSKH63607,Human G Protein Coupled Estrogen Receptor 1 (GPER) ELISA Kit
BSKH63608,Human Glycosylphosphatidylinositol Specific Phospholipase D1 (GPLD1) ELISA Kit
BSKH63609,Human G Protein Coupled Receptor 109B (GPR109B) ELISA Kit
BSKH63610,Human G Protein Coupled Receptor 120 (GPR120) ELISA Kit
BSKH63611,Human G Protein Coupled Receptor 35 (GPR35) ELISA Kit
BSKH63612,Human G Protein Coupled Receptor 37 (GPR37) ELISA Kit
BSKH63613,Human G Protein Coupled Receptor 78 (GPR78) ELISA Kit
BSKH63614,"Human Glutathione Peroxidase 2, Gastrointestinal (GPX2) ELISA Kit"
BSKH63615,"Human Glutathione Peroxidase 3, Plasma (GPX3) ELISA Kit"
BSKH63616,Human Glutathione Peroxidase 4 (GPX4) ELISA Kit
BSKH63617,Human Gremlin 1 (GREM1) ELISA Kit
BSKH63618,"Human Glutamate Receptor, Ionotropic, AMPA 1 (GRIA1) ELISA Kit"
BSKH63619,"Human Glutamate Receptor, Ionotropic, AMPA 2 (GRIA2) ELISA Kit"
BSKH63620,"Human Glutamate Receptor, Ionotropic, AMPA 3 (GRIA3) ELISA Kit"
BSKH63621,"Human Glutamate Receptor, Ionotropic, AMPA 4 (GRIA4) ELISA Kit"
BSKH63622,"Human Glutamate Receptor, Ionotropic, N-Methyl-D-Aspartate 1 (GRIN1) ELISA Kit"
BSKH63623,"Human Glutamate Receptor, Ionotropic, N-Methyl-D-Aspartate 2A (GRIN2A) ELISA Kit"
BSKH63624,"Human Glutamate Receptor, Ionotropic, N-Methyl-D-Aspartate 2B (GRIN2B) ELISA Kit"
BSKH63625,"Human Glutamate Receptor, Ionotropic, N-Methyl-D-Aspartate 2C (GRIN2C) ELISA Kit"
BSKH63626,"Human Glutamate Receptor, Ionotropic, N-Methyl-D-Aspartate 2D (GRIN2D) ELISA Kit"
BSKH63627,Human Granulin (GRN) ELISA Kit
BSKH63628,Human Gastrin Releasing Peptide (GRP) ELISA Kit
BSKH63629,Human Glycogen Synthase Kinase 3 Beta (GSK3b) ELISA Kit
BSKH63630,Human Glutathione Synthetase (GSS) ELISA Kit
BSKH63631,"Human General Transcription Factor IIA, Polypeptide 1 (GTF2A1) ELISA Kit"
BSKH63632,Human Guanylate Cyclase Activator 2A (GUCA2A) ELISA Kit
BSKH63633,Human Guanylate Cyclase Activator 2B (GUCA2B) ELISA Kit
BSKH63634,"Human H2A Histone Family, Member V (H2AFV) ELISA Kit"
BSKH63635,Human Histone H4 (H4) ELISA Kit
BSKH63636,Human Hyaluronan Binding Protein 2 (HABP2) ELISA Kit
BSKH63637,Human Hydroxyacyl Coenzyme A Dehydrogenase Beta (HADHb) ELISA Kit
BSKH63638,Human Huntingtin Associated Protein 1 (HAP1) ELISA Kit
BSKH63639,Human Hyaluronan Synthase 1 (HAS1) ELISA Kit
BSKH63640,Human Hyaluronan Synthase 2 (HAS2) ELISA Kit
BSKH63641,Human Hepatitis A Virus Cellular Receptor 2 (HAVCR2) ELISA Kit
BSKH63642,Human Hemoglobin Beta (HBb) ELISA Kit
BSKH63643,Human Hemoglobin Gamma 1 (HBg1) ELISA Kit
BSKH63644,Human Hemoglobin Gamma 2 (HBg2) ELISA Kit
BSKH63645,Human Holocytochrome C Synthase (HCCS) ELISA Kit
BSKH63646,Human Histone Deacetylase 1 (HDAC1) ELISA Kit
BSKH63647,Human Histone Deacetylase 2 (HDAC2) ELISA Kit
BSKH63648,Human Histone Deacetylase 4 (HDAC4) ELISA Kit
BSKH63649,Human Histone Deacetylase 5 (HDAC5) ELISA Kit
BSKH63650,Human Histone Deacetylase 6 (HDAC6) ELISA Kit
BSKH63651,Human Histone Deacetylase 9 (HDAC9) ELISA Kit
BSKH63652,Human Histidine Decarboxylase (HDC) ELISA Kit
BSKH63653,Human Hemogen (HEMGN) ELISA Kit
BSKH63654,Human Hephaestin (HEPH) ELISA Kit
BSKH63655,"Human Homogentisate-1,2-Dioxygenase (HGD) ELISA Kit"
BSKH63656,Human Hedgehog Interacting Protein (HHIP) ELISA Kit
BSKH63657,Human Hypoxia Inducible Factor 2 Alpha (HIF2a) ELISA Kit
BSKH63658,Human Hexokinase 2 (HK2) ELISA Kit
BSKH63659,Human Hydroxymethylbilane Synthase (HMBS) ELISA Kit
BSKH63660,Human High Mobility Group AT Hook Protein 1 (HMGA1) ELISA Kit
BSKH63661,Human High Mobility Group AT Hook Protein 2 (HMGA2) ELISA Kit
BSKH63662,Human 3-Hydroxy-3-Methylglutaryl Coenzyme A Reductase (HMGCR) ELISA Kit
BSKH63663,Human Hyaluronan Mediated Motility Receptor (HMMR) ELISA Kit
BSKH63664,Human Hepatocyte Nuclear Factor 1 Beta (HNF1b) ELISA Kit
BSKH63665,Human Heterogeneous Nuclear Ribonucleoprotein K (HNRPK) ELISA Kit
BSKH63666,Human Heterogeneous Nuclear Ribonucleoprotein U (HNRPU) ELISA Kit
BSKH63667,Human 4-Hydroxyphenylpyruvate Dioxygenase (HPD) ELISA Kit
BSKH63668,Human Histidine Rich Calcium Binding Protein (HRC) ELISA Kit
BSKH63669,Human Histidine Rich Glycoprotein (HRG) ELISA Kit
BSKH63670,Human Histamine Receptor H1 (HRH1) ELISA Kit
BSKH63671,Human Histamine Receptor H3 (HRH3) ELISA Kit
BSKH63672,Human Histamine Receptor H4 (HRH4) ELISA Kit
BSKH63673,Human Hornerin (HRNR) ELISA Kit
BSKH63674,Human Heparan Sulfate-2-O-Sulfotransferase 1 (HS2ST1) ELISA Kit
BSKH63675,Human Heparan Sulfate-6-O-Sulfotransferase 1 (HS6ST1) ELISA Kit
BSKH63676,Human Heparan Sulfate-6-O-Sulfotransferase 2 (HS6ST2) ELISA Kit
BSKH63677,Human Heparan Sulfate-6-O-Sulfotransferase 3 (HS6ST3) ELISA Kit
BSKH63678,Human 11-Beta-Hydroxysteroid Dehydrogenase Type 1 (HSD11b1) ELISA Kit
BSKH63679,Human 11-Beta-Hydroxysteroid Dehydrogenase Type 2 (HSD11b2) ELISA Kit
BSKH63680,Human 17-Beta-Hydroxysteroid Dehydrogenase Type 14 (HSD17b14) ELISA Kit
BSKH63681,Human 17-Beta-Hydroxysteroid Dehydrogenase Type 3 (HSD17b3) ELISA Kit
BSKH63682,Human Heat Shock Protein 90kDa Alpha A1 (HSP90aA1) ELISA Kit
BSKH63683,Human Heat Shock Protein 90kDa Alpha B1 (HSP90aB1) ELISA Kit
BSKH63684,Human Heat Shock 70kDa Protein 2 (HSPA2) ELISA Kit
BSKH63685,Human Heat Shock 70kDa Protein 5 (HSPA5) ELISA Kit
BSKH63686,Human Heat Shock Protein Beta 3 (HSPb3) ELISA Kit
BSKH63687,Human Heat Shock Protein Beta 7 (HSPb7) ELISA Kit
BSKH63688,Human Heat Shock Protein Beta 8 (HSPb8) ELISA Kit
BSKH63689,Human Heat Shock 70kDa Binding Protein 1 (HSPBP1) ELISA Kit
BSKH63690,Human Heat Shock 40kDa Protein 2 (HSPF2) ELISA Kit
BSKH63691,Human Heparan Sulfate Proteoglycan 2 (HSPG2) ELISA Kit
BSKH63692,Human Histatin 1 (HTN1) ELISA Kit
BSKH63693,Human Histatin 3 (HTN3) ELISA Kit
BSKH63694,Human 5-Hydroxytryptamine Receptor 1A (HTR1A) ELISA Kit
BSKH63695,Human 5-Hydroxytryptamine Receptor 2A (HTR2A) ELISA Kit
BSKH63696,Human 5-Hydroxytryptamine Receptor 2C (HTR2C) ELISA Kit
BSKH63697,Human 5-Hydroxytryptamine Receptor 4 (HTR4) ELISA Kit
BSKH63698,Human Huntingtin (HTT) ELISA Kit
BSKH63699,Human Hydrogen Voltage Gated Channel Protein 1 (HVCN1) ELISA Kit
BSKH63700,Human Hypoxia Up Regulated 1 (HYOU1) ELISA Kit
BSKH63701,Human Isoleucyl tRNA Synthetase (IARS) ELISA Kit
BSKH63702,"Human Isocitrate Dehydrogenase 1, Soluble (IDH1) ELISA Kit"
BSKH63703,"Human Isocitrate Dehydrogenase 2, mitochondrial (IDH2) ELISA Kit"
BSKH63704,Human Iduronate-2-Sulfatase (IDS) ELISA Kit
BSKH63705,Human Iduronidase Alpha L (IDUa) ELISA Kit
BSKH63706,"Human Hedgehog Homolog, Indian (IHH) ELISA Kit"
BSKH63707,Human Inhibitor Of Kappa-Light Polypeptide Gene Enhancer In B-Cells Kinase Beta (IkBKb) ELISA Kit
BSKH63708,Human Inhibitor Of Kappa Light Polypeptide Gene Enhancer In B-Cells Kinase Gamma (IkBKg) ELISA Kit
BSKH63709,Human Inosine 5'-Monophosphate Dehydrogenase 2 (IMPDH2) ELISA Kit
BSKH63710,Human Internexin Neuronal Intermediate Filament Protein Alpha (INa) ELISA Kit
BSKH63711,Human Insulin Like Protein 3 (INSL3) ELISA Kit
BSKH63712,Human Insulin Like Protein 5 (INSL5) ELISA Kit
BSKH63713,Human Iron Responsive Element Binding Protein 2 (IREB2) ELISA Kit
BSKH63714,Human Insulin Receptor Substrate 1 (IRS1) ELISA Kit
BSKH63715,Human ISL LIM Homeobox Protein 1 (ISL1) ELISA Kit
BSKH63716,Human Immunoglobulin Superfamily Containing Leucine Rich Repeat Protein (ISLR) ELISA Kit
BSKH63717,Human Anion/Sugar Transporter (AST) ELISA Kit
BSKH63718,Human Integrin Alpha 11 (ITGa11) ELISA Kit
BSKH63719,Human Integrin Beta 5 (ITGb5) ELISA Kit
BSKH63720,Human Integrin Beta 6 (ITGb6) ELISA Kit
BSKH63721,Human Inter Alpha-Globulin Inhibitor H1 (ITIH1) ELISA Kit
BSKH63722,Human Inter Alpha-Globulin Inhibitor H2 (ITIH2) ELISA Kit
BSKH63723,Human Inter Alpha-Globulin Inhibitor H3 (ITIH3) ELISA Kit
BSKH63724,Human Inter Alpha-Globulin Inhibitor H4 (ITIH4) ELISA Kit
BSKH63725,Human Inter Alpha-Globulin Inhibitor H5 (ITIH5) ELISA Kit
BSKH63726,Human Intelectin 2 (ITLN2) ELISA Kit
BSKH63727,Human Janus Kinase 1 (JAK1) ELISA Kit
BSKH63728,Human Janus Kinase 2 (JAK2) ELISA Kit
BSKH63729,Human Janus Kinase 3 (JAK3) ELISA Kit
BSKM63730,Mouse V-Jun Sarcoma Virus 17 Oncogene Homolog (JUN) ELISA Kit
BSKH63731,Human Junction Plakoglobin (JUP) ELISA Kit
BSKH63732,Human Kallistatin (KAL) ELISA Kit
BSKH63733,Human Lysyl tRNA Synthetase (KARS) ELISA Kit
BSKH63734,Human Lysine Specific Demethylase 4A (KDM4A) ELISA Kit
BSKH63735,Human Keratocan (KERA) ELISA Kit
BSKH63736,Human Ki-67 Protein (Ki67P) ELISA Kit
BSKH63737,"Human Kinesin Family, Member 14 (KIF14) ELISA Kit"
BSKH63738,"Human Kinesin Family, Member 18A (KIF18A) ELISA Kit"
BSKH63739,"Human Kinesin Family, Member 1A (KIF1A) ELISA Kit"
BSKH63740,"Human Kinesin Family, Member 20A (KIF20A) ELISA Kit"
BSKH63741,"Human Kinesin Family, Member 5A (KIF5A) ELISA Kit"
BSKH63742,"Human Kinesin Family, Member 5B (KIF5B) ELISA Kit"
BSKH63743,Human Kisspeptin 1 (KISS1) ELISA Kit
BSKH63744,Human Kisspeptin Receptor (KISS1R) ELISA Kit
BSKH63745,Human Klotho Beta (KLb) ELISA Kit
BSKH63746,Human Kruppel Like Factor 15 (KLF15) ELISA Kit
BSKH63747,"Human Kruppel Like Factor 2, Lung (KLF2) ELISA Kit"
BSKH63748,Human Klotho (KL) ELISA Kit
BSKH63749,Human Kallikrein 12 (KLK12) ELISA Kit
BSKH63750,Human Kallikrein 13 (KLK13) ELISA Kit
BSKH63751,Human Kallikrein 14 (KLK14) ELISA Kit
BSKH63752,Human Kallikrein 2 (KLK2) ELISA Kit
BSKH63753,Human Kynurenine-3-Monooxygenase (KMO) ELISA Kit
BSKH63754,Human Kinesin 2 (KNS2) ELISA Kit
BSKH63755,Human Karyopherin Alpha 2 (KPNa2) ELISA Kit
BSKH63756,Human V-Ki-Ras2 Kirsten Rat Sarcoma Viral Oncogene Homolog (KRAS) ELISA Kit
BSKH63757,Human Keratin 6A (KRT6A) ELISA Kit
BSKH63758,Human Keratin 8 (KRT8) ELISA Kit
BSKH63759,Human Kynureninase (KYNU) ELISA Kit
BSKH63760,Human Lacritin (LACRT) ELISA Kit
BSKH63761,Human Lactamase Beta (LACTb) ELISA Kit
BSKH63762,Human Laminin Alpha 3 (LAMa3) ELISA Kit
BSKH63763,Human Laminin Alpha 4 (LAMa4) ELISA Kit
BSKH63764,Human Laminin Alpha 5 (LAMa5) ELISA Kit
BSKH63765,Human Laminin Beta 2 (LAMb2) ELISA Kit
BSKH63766,Human Laminin Beta 3 (LAMb3) ELISA Kit
BSKH63767,Human Laminin Gamma 1 (LAMC1) ELISA Kit
BSKH63768,Human Laminin Gamma 2 (LAMC2) ELISA Kit
BSKH63769,Human LIM And SH3 Protein 1 (LASP1) ELISA Kit
BSKH63770,Human Large Neutral Amino Acid Transporter 1 (LAT1) ELISA Kit
BSKH63771,Human Lecithin Cholesterol Acyltransferase (LCAT) ELISA Kit
BSKH63772,Human Lactase (LCT) ELISA Kit
BSKH63773,Human LIM Domain Binding Protein 1 (LDB1) ELISA Kit
BSKH63774,Human Lactate Dehydrogenase C (LDHC) ELISA Kit
BSKH63775,Human Lactate Dehydrogenase D (LDHD) ELISA Kit
BSKH63776,Human Low Density Lipoprotein Receptor Adaptor Protein 1 (LDLRAP1) ELISA Kit
BSKH63777,Human Leukocyte Cell Derived Chemotaxin 1 (LECT1) ELISA Kit
BSKH63778,Human Leukocyte Cell Derived Chemotaxin 2 (LECT2) ELISA Kit
BSKH63779,Human Left/Right Determination Factor 1 (LEFTY1) ELISA Kit
BSKH63780,Human Leukocyte Elastase Inhibitor (LEI) ELISA Kit
BSKH63781,Human Leprecan Like Protein 1 (LEPREL1) ELISA Kit
BSKH63782,"Human Leucine Rich Repeat LGI Family, Member 3 (LGI3) ELISA Kit"
BSKH63783,Human Legumain (LGMN) ELISA Kit
BSKH63784,"Human Lipophilin B, Prostatein Like (LIPB) ELISA Kit"
BSKH63785,"Human Lipase, Gastric (LIPF) ELISA Kit"
BSKH63786,Human Lipase H (LIPH) ELISA Kit
BSKH63787,"Human Lectin, Mannose Binding 2 (LMAN2) ELISA Kit"
BSKH63788,Human Lamin A/C (LMNA) ELISA Kit
BSKH63789,Human Lamin B1 (LMNB1) ELISA Kit
BSKH63790,Human Lamin B2 (LMNB2) ELISA Kit
BSKH63791,Human Lemur Tyrosine Kinase 3 (LMTK3) ELISA Kit
BSKH63792,Human Leucyl/Cystinyl Aminopeptidase (LNPEP) ELISA Kit
BSKH63793,Human Loricrin (LOR) ELISA Kit
BSKH63794,Human Lysyl Oxidase (LOX) ELISA Kit
BSKH63795,Human Lysyl Oxidase Like Protein 1 (LOXL1) ELISA Kit
BSKH63796,Human Lysyl Oxidase Like Protein 2 (LOXL2) ELISA Kit
BSKH63797,Human Lysyl Oxidase Like Protein 3 (LOXL3) ELISA Kit
BSKH63798,Human Lysyl Oxidase Like Protein 4 (LOXL4) ELISA Kit
BSKH63799,Human Lysophosphatidic Acid Receptor 1 (LPAR1) ELISA Kit
BSKH63800,Human Lysophosphatidic Acid Receptor 3 (LPAR3) ELISA Kit
BSKH63801,Human Lysophosphatidylcholine Acyltransferase 1 (LPCAT1) ELISA Kit
BSKH63802,Human Lysophosphatidylcholine Acyltransferase 2 (LPCAT2) ELISA Kit
BSKH63803,Human Lysophosphatidylcholine Acyltransferase 3 (LPCAT3) ELISA Kit
BSKH63804,Human Leucine-Rich Repeat And Calponin Homology Domain-Containing Protein 4 (LRCH4) ELISA Kit
BSKH63805,Human Liver Receptor Homolog 1 (LRH1) ELISA Kit
BSKH63806,Human Low Density Lipoprotein Receptor Related Protein 2 (LRP2) ELISA Kit
BSKH63807,Human Low Density Lipoprotein Receptor Related Protein 4 (LRP4) ELISA Kit
BSKH63808,Human Low Density Lipoprotein Receptor Related Protein 5 (LRP5) ELISA Kit
BSKH63809,Human Low Density Lipoprotein Receptor Related Protein 6 (LRP6) ELISA Kit
BSKH63810,Human Leucine Rich Repeat In FLII Interacting Protein 1 (LRRFIP1) ELISA Kit
BSKH63811,Human Leucine Rich Repeat Kinase 2 (LRRK2) ELISA Kit
BSKH63812,Human Lipolysis Stimulated Lipoprotein Receptor (LSR) ELISA Kit
BSKH63813,Human Leukotriene A4 Hydrolase (LTA4H) ELISA Kit
BSKH63814,Human Liver X Receptor Alpha (LXRa) ELISA Kit
BSKH63815,Human V-Yes-1 Yamaguchi Sarcoma Viral Related Oncogene Homolog (LYN) ELISA Kit
BSKH63816,Human V-Maf Musculoaponeurotic Fibrosarcoma Oncogene Homolog (MAF) ELISA Kit
BSKH63817,Human Mannosidase Alpha Class 1A Member 1 (MAN1A1) ELISA Kit
BSKH63818,Human Mannosidase Alpha Class 2B Member 1 (MAN2B1) ELISA Kit
BSKH63819,Human Mesencephalic Astrocyte Derived Neurotrophic Factor (MANF) ELISA Kit
BSKH63820,Human Monoamine Oxidase A (MAOA) ELISA Kit
BSKH63821,Human Mitogen Activated Protein Kinase Kinase 1 (MAP2K1) ELISA Kit
BSKH63822,Human Mitogen Activated Protein Kinase 12 (MAPK12) ELISA Kit
BSKH63823,Human Mitogen Activated Protein Kinase 13 (MAPK13) ELISA Kit
BSKH63824,"Human Microtubule Associated Protein RP/EB Family, Member 1 (MAPRE1) ELISA Kit"
BSKH63825,Human Myristoylated Alanine Rich Protein Kinase C Substrate (MARCKS) ELISA Kit
BSKH63826,Human Mammary Serine Protease Inhibitor (Maspin) ELISA Kit
BSKH63827,Human Microtubule Associated Serine/Threonine Kinase 2 (MAST2) ELISA Kit
BSKH63828,Human Methionine Adenosyltransferase I Alpha (MAT1a) ELISA Kit
BSKH63829,Human Methionine Adenosyltransferase II Alpha (MAT2a) ELISA Kit
BSKH63830,Human Matrin 3 (MATR3) ELISA Kit
BSKH63831,Human MYC Associated Factor X (MAX) ELISA Kit
BSKH63832,Human Melanocortin 5 Receptor (MC5R) ELISA Kit
BSKH63833,Human Melanin Concentrating Hormone Receptor 1 (MCHR1) ELISA Kit
BSKH63834,"Human Myeloid Cell Leukemia Sequence 1, Bcl2 Related (MCL1) ELISA Kit"
BSKH63835,Human Minichromosome Maintenance Deficient 5 (MCM5) ELISA Kit
BSKH63836,Human Malate Dehydrogenase 1 (MDH1) ELISA Kit
BSKH63837,Human Malate Dehydrogenase 2 (MDH2) ELISA Kit
BSKH63838,Human Mdm2 p53 Binding Protein Homolog (MDM2) ELISA Kit
BSKH63839,"Human Malic Enzyme 2, NADP+ Dependent, Mitochondrial (ME2) ELISA Kit"
BSKH63840,Human Methyl CpG Binding Protein 2 (MECP2) ELISA Kit
BSKH63841,Human Maternal Embryonic Leucine Zipper Kinase (MELK) ELISA Kit
BSKH63842,Human C-Mer Proto Oncogene Tyrosine Kinase (MERTK) ELISA Kit
BSKH63843,Human Methionyl Aminopeptidase 2 (METAP2) ELISA Kit
BSKH63844,Human Meteorin (METRN) ELISA Kit
BSKH63845,Human Microfibrillar Associated Protein 4 (MFAP4) ELISA Kit
BSKH63846,Human Mitoferrin (MFRN) ELISA Kit
BSKH63847,"Human Lipase, Monoacylglycerol (MGL) ELISA Kit"
BSKH63848,Human O-6-Methylguanine DNA Methyltransferase (MGMT) ELISA Kit
BSKH63849,Human Major Histocompatibility Complex Class I A (MHCA) ELISA Kit
BSKH63850,Human Major Histocompatibility Complex Class I B (MHCB) ELISA Kit
BSKH63851,Human Major Histocompatibility Complex Class I C (MHCC) ELISA Kit
BSKH63852,Human Major Histocompatibility Complex Class II DQ Beta 1 (MHCDQb1) ELISA Kit
BSKH63853,Human Major Histocompatibility Complex Class II DR Beta 1 (MHCDRb1) ELISA Kit
BSKH63854,Human Melanoma Inhibitory Activity Protein 1 (MIA1) ELISA Kit
BSKH63855,Human Myo Inositol Oxygenase (MIOX) ELISA Kit
BSKH63856,Human Microphthalmia Associated Transcription Factor (MITF) ELISA Kit
BSKH63857,Human MutL Homolog 1 (MLH1) ELISA Kit
BSKH63858,Human Matrix Metalloproteinase 14 (MMP14) ELISA Kit
BSKH63859,Human Multimerin 1 (MMRN1) ELISA Kit
BSKH63860,Human Multimerin 2 (MMRN2) ELISA Kit
BSKH63861,Human Monoacylglycerol-O-acyltransferase 2 (MOGAT2) ELISA Kit
BSKH63862,Human N-Methylpurine DNA Glycosylase (MPG) ELISA Kit
BSKH63863,Human Mannose Phosphate Isomerase (MPI) ELISA Kit
BSKH63864,Human Mercaptopyruvate Sulfurtransferase (MPST) ELISA Kit
BSKH63865,Human Mesothelin (MSLN) ELISA Kit
BSKH63866,Human Microseminoprotein Beta (MSMb) ELISA Kit
BSKH63867,Human Moesin (MSN) ELISA Kit
BSKH63868,Human Methionine Sulfoxide Reductase A (MSRA) ELISA Kit
BSKH63869,Human Metallothionein 1E (MT1E) ELISA Kit
BSKH63870,Human Metallothionein 1M (MT1M) ELISA Kit
BSKH63871,Human Methylthioadenosine Phosphorylase (MTAP) ELISA Kit
BSKH63872,Human Metadherin (MTDH) ELISA Kit
BSKH63873,Human Methylenetetrahydrofolate Reductase (MTHFR) ELISA Kit
BSKH63874,Human Melatonin Receptor 1A (MTNR1A) ELISA Kit
BSKH63875,Human Melatonin Receptor 1B (MTNR1B) ELISA Kit
BSKH63876,Human 5-Methyltetrahydrofolate Homocysteine Methyltransferase (MTR) ELISA Kit
BSKH63877,Human Microsomal Triglyceride Transfer Protein (MTTP) ELISA Kit
BSKH63878,Human Mucin 21 (MUC21) ELISA Kit
BSKH63879,"Human Muscle, Skeletal, Receptor Tyrosine Kinase (MUSK) ELISA Kit"
BSKH63880,Human MutY Homolog (MUTYH) ELISA Kit
BSKH63881,Human Mevalonate Decarboxylase (MVD) ELISA Kit
BSKH63882,"Human Myosin Binding Protein C, Cardiac (MYBPC3) ELISA Kit"
BSKH63883,Human C-Myc Binding Protein (MYCBP) ELISA Kit
BSKH63884,Human Myogenic Factor 5 (MYF5) ELISA Kit
BSKH63885,"Human Myosin Heavy Chain 10, Non Muscle (MYH10) ELISA Kit"
