sku,description
BSKM64712,Mouse Cytochrome P450 11B1 (CYP11B1) ELISA Kit
BSKM64713,Mouse Cytochrome P450 27B1 (CYP27B1) ELISA Kit
BSKM64714,"Mouse Cysteine Rich Protein, Angiogenic Inducer 61 (CYR61) ELISA Kit"
BSKM64715,Mouse Disabled Homolog 1 (DAB1) ELISA Kit
BSKM64716,Mouse D Site Of Albumin Promoter Binding Protein (DBP) ELISA Kit
BSKM64717,Mouse Dystrophin Associated Glycoprotein 1 (DAG1) ELISA Kit
BSKM64718,Mouse Death Associated Protein Kinase 1 (DAPK1) ELISA Kit
BSKM64719,Mouse Death Associated Protein Kinase 3 (DAPK3) ELISA Kit
BSKM64720,Mouse Diazepam Binding Inhibitor (DBI) ELISA Kit
BSKM64721,Mouse Drebrin 1 (DBN1) ELISA Kit
BSKM64722,Mouse Doublecortin Like Kinase 1 (DCLK1) ELISA Kit
BSKM64723,Mouse Doublecortin (DCX) ELISA Kit
BSKM64724,Mouse DNA Damage Inducible Transcript 3 (DDIT3) ELISA Kit
BSKM64725,Mouse D-Dopachrome Tautomerase (DDT) ELISA Kit
BSKM64726,Mouse Defensin Beta 3 (Defb3) ELISA Kit
BSKM64727,Mouse Diacylglycerol-O-Acyltransferase Homolog 1 (DGAT1) ELISA Kit
BSKM64728,Mouse Dihydroorotate Dehydrogenase (DHODH) ELISA Kit
BSKM64729,"Mouse Deiodinase, Iodothyronine, Type II (DIO2) ELISA Kit"
BSKM64730,"Mouse Deiodinase, Iodothyronine, Type III (DIO3) ELISA Kit"
BSKM64731,Mouse Dickkopf Related Protein 3 (DKK3) ELISA Kit
BSKM64732,"Mouse Discs, Large Homolog 4 (DLG4) ELISA Kit"
BSKM64733,Mouse Divalent Metal Transporter 1 (DMT1) ELISA Kit
BSKM64734,Mouse DNA Methyltransferase 1 (DNMT1) ELISA Kit
BSKM64735,Mouse DNA Methyltransferase 3B (DNMT3B) ELISA Kit
BSKM64736,Mouse Dipeptidyl Peptidase 8 (DPP8) ELISA Kit
BSKM64737,Mouse Dipeptidyl Peptidase 9 (DPP9) ELISA Kit
BSKM64738,Mouse Dermatopontin (DPT) ELISA Kit
BSKM64739,Mouse Dihydropyrimidine Dehydrogenase (DPYD) ELISA Kit
BSKM64740,Mouse Desmocollin 1 (DSC1) ELISA Kit
BSKM64741,Mouse Dual Serine/Threonine And Tyrosine Protein Kinase (DSTYK) ELISA Kit
BSKM64742,Mouse Dual Specificity Phosphatase 1 (DUSP1) ELISA Kit
BSKM64743,Mouse Dual Specificity Phosphatase 5 (DUSP5) ELISA Kit
BSKM64744,Mouse Dual Specificity Tyrosine Phosphorylation Regulated Kinase 1A (DYRK1A) ELISA Kit
BSKM64745,Mouse Excitatory Amino Acid Transporter 2 (EAAT2) ELISA Kit
BSKM64746,Mouse Epstein Barr Virus Induced Protein 3 (EBI3) ELISA Kit
BSKI64747,Guinea pig Eosinophil Chemotactic Factor (ECF) ELISA Kit
BSKM64748,Mouse Extracellular Matrix Protein 1 (ECM1) ELISA Kit
BSKM64749,Mouse Endothelin 3 (EDN3) ELISA Kit
BSKM64750,Mouse Ephrin B2 (EFNB2) ELISA Kit
BSKM64751,Mouse Eukaryotic Translation Initiation Factor 2 Alpha Kinase 3 (EIF2aK3) ELISA Kit
BSKM64752,Mouse Elastase 2A (ELA2A) ELISA Kit
BSKD64753,"Canine Elastase 2, Neutrophil (ELA2) ELISA Kit"
BSKM64754,Mouse ELAV Like Protein 1 (ELAVL1) ELISA Kit
BSKM64755,Mouse Elastin Microfibril Interface Located Protein 2 (EMILIN2) ELISA Kit
BSKD64756,Canine Endoglin (ENG) ELISA Kit
BSKM64757,Mouse Ectonucleotide Pyrophosphatase/Phosphodiesterase 2 (ENPP2) ELISA Kit
BSKM64758,Mouse Endosulfine Alpha (ENSa) ELISA Kit
BSKM64759,Mouse E1A Binding Protein P300 (EP300) ELISA Kit
BSKM64760,Mouse Ephrin Type B Receptor 3 (EPHB3) ELISA Kit
BSKD64761,Canine Erythropoietin (EPO) ELISA Kit
BSKM64762,Mouse Eosinophil Peroxidase (EPX) ELISA Kit
BSKM64763,Mouse V-Erb B2 Erythroblastic Leukemia Viral Oncogene Homolog 3 (ErbB3) ELISA Kit
BSKM64764,Mouse V-Ets Erythroblastosis Virus E26 Oncogene Homolog 1 (ETS1) ELISA Kit
BSKM64765,Mouse Enhancer Of Zeste Homolog 1 (EZH1) ELISA Kit
BSKM64766,Mouse Fibroblast Activation Protein Alpha (FAPa) ELISA Kit
BSKM64767,Mouse Fatty Acid Synthase (FASN) ELISA Kit
BSKM64768,Mouse Fatty Acid Transport Protein 1 (FATP1) ELISA Kit
BSKM64769,Mouse Fatty Acid Transport Protein 4 (FATP4) ELISA Kit
BSKM64770,Mouse Fibulin 2 (FBLN2) ELISA Kit
BSKM64771,Mouse Fibulin 3 (FBLN3) ELISA Kit
BSKM64772,Mouse Fibulin 7 (FBLN7) ELISA Kit
BSKM64773,Mouse F-Box And Leucine Rich Repeat Protein 3 (FBXL3) ELISA Kit
BSKH64774,Mouse Free Fatty Acid Receptor 1 (FFAR1) ELISA Kit
BSKM64775,Mouse Free Fatty Acid Receptor 2 (FFAR2) ELISA Kit
BSKM64776,Mouse Fibrinogen Like Protein 1 (FGL1) ELISA Kit
BSKM64777,Mouse Filaggrin (FLG) ELISA Kit
BSKM64778,"Mouse Folate Receptor 1, Adult (FOLR1) ELISA Kit"
BSKM64779,Mouse Forkhead Box Protein A2 (FOXA2) ELISA Kit
BSKM64780,Mouse Ferroportin (FPN) ELISA Kit
BSKM64781,Mouse Follistatin Like Protein 3 (FSTL3) ELISA Kit
BSKM64782,"Mouse Ferritin, Heavy Polypeptide (FTH) ELISA Kit"
BSKM64783,"Mouse Ferritin, Light Polypeptide (FTL) ELISA Kit"
BSKM64784,Mouse Fusion (FUS) ELISA Kit
BSKM64785,Mouse Fucosyltransferase 8 (FUT8) ELISA Kit
BSKM64786,Mouse Farnesoid X Receptor (FXR) ELISA Kit
BSKM64787,Mouse FYN Oncogene Related To SRC/FGR/YES (FYN) ELISA Kit
BSKM64788,"Mouse Glucose-6-Phosphatase, Catalytic (G6PC) ELISA Kit"
BSKM64789,Mouse Gamma-Aminobutyric Acid A Receptor Alpha 2 (gABRa2) ELISA Kit
BSKM64790,"Mouse Glutamate Decarboxylase 1, Brain (GAD1) ELISA Kit"
BSKM64791,Mouse Galactose-1-Phosphate Uridylyltransferase (GALT) ELISA Kit
BSKM64792,"Mouse Glucosidase Beta, Acid (GbA) ELISA Kit"
BSKM64793,"Mouse Glutamate Cysteine Ligase, Catalytic (GCLC) ELISA Kit"
BSKM64794,Mouse Growth Differentiation Factor 11 (GDF11) ELISA Kit
BSKM64795,Mouse Growth Differentiation Factor 15 (GDF15) ELISA Kit
BSKM64796,Mouse Growth Differentiation Factor 1 (GDF1) ELISA Kit
BSKM64797,Mouse Growth Differentiation Factor 3 (GDF3) ELISA Kit
BSKM64798,Mouse Growth Differentiation Factor 5 (GDF5) ELISA Kit
BSKM64799,Mouse Gamma-Endorphin (gEP) ELISA Kit
BSKD64800,Canine Growth Hormone (GH) ELISA Kit
BSKM64801,Mouse Glycine Dehydrogenase (GLDC) ELISA Kit
BSKM64802,Mouse Glutamine synthetase (GS) ELISA Kit
BSKM64803,Mouse Glucagon Like Peptide 1 Receptor (GLP1R) ELISA Kit
BSKM64804,Mouse Glutaredoxin (GLRX) ELISA Kit
BSKM64805,Mouse Glutaminase 2 (GLS2) ELISA Kit
BSKM64806,Mouse Glutaminase (GLS) ELISA Kit
BSKM64807,Mouse Glucose Transporter 4 (GLUT4) ELISA Kit
BSKM64808,Mouse G Protein Beta 1 (GNb1) ELISA Kit
BSKM64809,Mouse Glycoprotein A33 (GPA33) ELISA Kit
BSKM64810,Mouse G Protein Coupled Estrogen Receptor 1 (GPER) ELISA Kit
BSKM64811,Mouse G Protein Coupled Receptor 120 (GPR120) ELISA Kit
BSKM64812,Mouse Gremlin 1 (GREM1) ELISA Kit
BSKM64813,"Mouse Glutamate Receptor, Ionotropic, AMPA 2 (GRIA2) ELISA Kit"
BSKM64814,"Mouse Glutamate Receptor, Ionotropic, AMPA 3 (GRIA3) ELISA Kit"
BSKM64815,"Mouse Glutamate Receptor, Ionotropic, AMPA 4 (GRIA4) ELISA Kit"
BSKM64816,"Mouse Glutamate Receptor, Ionotropic, N-Methyl-D-Aspartate 1 (GRIN1) ELISA Kit"
BSKM64817,"Mouse Glutamate Receptor, Ionotropic, N-Methyl-D-Aspartate 2A (GRIN2A) ELISA Kit"
BSKM64818,Mouse Granulin (GRN) ELISA Kit
BSKM64819,Mouse Glycogen Synthase Kinase 3 Beta (GSK3b) ELISA Kit
BSKM64820,Mouse Glutathione Synthetase (GSS) ELISA Kit
BSKM64821,Mouse Guanylate Cyclase Activator 2A (GUCA2A) ELISA Kit
BSKM64822,Mouse Histone H4 (H4) ELISA Kit
BSKM64823,Mouse Hydroxyacyl Coenzyme A Dehydrogenase Beta (HADHb) ELISA Kit
BSKM64824,Mouse Hyaluronan Synthase 2 (HAS2) ELISA Kit
BSKM64825,Mouse Histone Deacetylase 1 (HDAC1) ELISA Kit
BSKM64826,Mouse Histone Deacetylase 2 (HDAC2) ELISA Kit
BSKM64827,Mouse Histone Deacetylase 4 (HDAC4) ELISA Kit
BSKM64828,Mouse Histone Deacetylase 6 (HDAC6) ELISA Kit
BSKM64829,Mouse Hedgehog Interacting Protein (HHIP) ELISA Kit
BSKM64830,Mouse Hypoxia Inducible Factor 2 Alpha (HIF2a) ELISA Kit
BSKM64831,Mouse Histidine Triad Nucleotide Binding Protein 2 (HINT2) ELISA Kit
BSKD64832,Canine High Mobility Group Protein 1 (HMG1) ELISA Kit
BSKM64833,Mouse 3-Hydroxy-3-Methylglutaryl Coenzyme A Reductase (HMGCR) ELISA Kit
BSKD64834,Canine Haptoglobin (Hpt) ELISA Kit
BSKM64835,Mouse Histidine Rich Glycoprotein (HRG) ELISA Kit
BSKM64836,Mouse Histamine Receptor H1 (HRH1) ELISA Kit
BSKM64837,Mouse Histamine Receptor H3 (HRH3) ELISA Kit
BSKM64838,Mouse Histamine Receptor H4 (HRH4) ELISA Kit
BSKM64839,Mouse 17-Beta-Hydroxysteroid Dehydrogenase Type 10 (HSD17b10) ELISA Kit
BSKM64840,Mouse Heat Shock Protein 90kDa Alpha A1 (HSP90aA1) ELISA Kit
BSKM64841,Mouse Heat Shock 70kDa Protein 5 (HSPA5) ELISA Kit
BSKM64842,Mouse Heat Shock Protein Beta 8 (HSPb8) ELISA Kit
BSKM64843,Mouse Heparan Sulfate Proteoglycan 2 (HSPG2) ELISA Kit
BSKM64844,Mouse 5-Hydroxytryptamine Receptor 2C (HTR2C) ELISA Kit
BSKM64845,Mouse Huntingtin (HTT) ELISA Kit
BSKD64846,Canine Intercellular Adhesion Molecule 1 (ICAM1) ELISA Kit
BSKM64847,"Mouse Indoleamine-2,3-Dioxygenase 2 (IDO2) ELISA Kit"
BSKM64848,"Mouse Hedgehog Homolog, Indian (IHH) ELISA Kit"
BSKM64849,Mouse Inhibitor Of Kappa-Light Polypeptide Gene Enhancer In B-Cells Kinase Beta (IkBKb) ELISA Kit
BSKD64850,Canine Interleukin 12B (IL12B) ELISA Kit
BSKI64851,Guinea pig Interleukin 12B (IL12B) ELISA Kit
BSKI64852,Guinea pig Interleukin 2 (IL2) ELISA Kit
BSKE64853,Equine Insulin (INS) ELISA Kit
BSKI64854,Guinea pig Insulin (INS) ELISA Kit
BSKM64855,Mouse Insulin Like Protein 3 (INSL3) ELISA Kit
BSKM64856,Mouse Insulin Like Protein 5 (INSL5) ELISA Kit
BSKM64857,Mouse Insulin Like Protein 6 (INSL6) ELISA Kit
BSKM64858,Mouse Insulin Promoter Factor 1 (IPF) ELISA Kit
BSKM64859,Mouse IQ Motif Containing GTPase Activating Protein 1 (IQGAP1) ELISA Kit
BSKM64860,Mouse IQ Motif Containing GTPase Activating Protein 2 (IQGAP2) ELISA Kit
BSKM64861,Mouse Insulin Receptor Substrate 1 (IRS1) ELISA Kit
BSKM64862,Mouse Insulin Receptor Substrate 2 (IRS2) ELISA Kit
BSKM64863,Mouse Inter Alpha-Globulin Inhibitor H4 (ITIH4) ELISA Kit
BSKM64864,Mouse Inter Alpha-Globulin Inhibitor H5 (ITIH5) ELISA Kit
BSKM64865,Mouse IL2 Inducible T-Cell Kinase (ITK) ELISA Kit
BSKM64866,Mouse Inosine Triphosphatase (ITPA) ELISA Kit
BSKM64867,Mouse Janus Kinase 2 (JAK2) ELISA Kit
BSKM64868,Mouse Jun B Proto Oncogene (JUNB) ELISA Kit
BSKM64869,Mouse Lysyl tRNA Synthetase (KARS) ELISA Kit
BSKM64870,Mouse Ki-67 Protein (Ki67P) ELISA Kit
BSKM64871,"Mouse Kinesin Family, Member 5B (KIF5B) ELISA Kit"
BSKM64872,Mouse Kisspeptin 1 (KISS1) ELISA Kit
BSKM64873,Mouse Kisspeptin Receptor (KISS1R) ELISA Kit
BSKM64874,Mouse Klotho Beta (KLb) ELISA Kit
BSKM64875,"Mouse Kruppel Like Factor 1, Erythroid (KLF1) ELISA Kit"
BSKM64876,Mouse Kallikrein 13 (KLK13) ELISA Kit
BSKM64877,Mouse Klotho (KL) ELISA Kit
BSKM64878,Mouse Lecithin Cholesterol Acyltransferase (LCAT) ELISA Kit
BSKM64879,Mouse Low Density Lipoprotein Receptor Adaptor Protein 1 (LDLRAP1) ELISA Kit
BSKM64880,Mouse Leukocyte Cell Derived Chemotaxin 1 (LECT1) ELISA Kit
BSKM64881,Mouse Leukocyte Cell Derived Chemotaxin 2 (LECT2) ELISA Kit
BSKM64882,Mouse Left/Right Determination Factor 1 (LEFTY1) ELISA Kit
BSKM64883,Mouse Left/Right Determination Factor 2 (LEFTY2) ELISA Kit
BSKD64884,Canine Leptin (LEP) ELISA Kit
BSKM64885,"Mouse Leucine Rich Repeat LGI Family, Member 3 (LGI3) ELISA Kit"
BSKM64886,Mouse Legumain (LGMN) ELISA Kit
BSKD64887,Canine Leukemia Inhibitory Factor (LIF) ELISA Kit
BSKM64888,"Mouse Lipase A, Lysosomal Acid (LIPA) ELISA Kit"
BSKM64889,Mouse Lamin A/C (LMNA) ELISA Kit
BSKM64890,Mouse Lysyl Oxidase Like Protein 1 (LOXL1) ELISA Kit
BSKM64891,Mouse Lysyl Oxidase Like Protein 2 (LOXL2) ELISA Kit
BSKM64892,Mouse Lysyl Oxidase (LOX) ELISA Kit
BSKM64893,Mouse Lysophosphatidic Acid Receptor 3 (LPAR3) ELISA Kit
BSKM64894,Mouse Lysophosphatidylcholine Acyltransferase 1 (LPCAT1) ELISA Kit
BSKM64895,Mouse Lysophosphatidylcholine Acyltransferase 2 (LPCAT2) ELISA Kit
BSKM64896,Mouse Lysophosphatidylcholine Acyltransferase 3 (LPCAT3) ELISA Kit
BSKM64897,Mouse Lysophosphatidylcholine Acyltransferase 4 (LPCAT4) ELISA Kit
BSKM64898,Mouse Lipin 1 (LPIN1) ELISA Kit
BSKM64899,Mouse Low Density Lipoprotein Receptor Related Protein 5 (LRP5) ELISA Kit
BSKM64900,Mouse Lipolysis Stimulated Lipoprotein Receptor (LSR) ELISA Kit
BSKM64901,Mouse Leukotriene A4 Hydrolase (LTA4H) ELISA Kit
BSKD64902,Canine Lactoferrin (LTF) ELISA Kit
BSKM64903,Mouse Liver X Receptor Alpha (LXRa) ELISA Kit
BSKM64904,Mouse Methionine Adenosyltransferase I Alpha (MAT1a) ELISA Kit
BSKM64905,Mouse Matrilin 2 (MATN2) ELISA Kit
BSKM64906,"Mouse Myeloid Cell Leukemia Sequence 1, Bcl2 Related (MCL1) ELISA Kit"
BSKD64907,Canine Monocyte Chemotactic Protein 1 (MCP1) ELISA Kit
BSKD64908,Canine Monocyte Chemotactic Protein 2 (MCP2) ELISA Kit
BSKM64909,Mouse Mdm2 p53 Binding Protein Homolog (MDM2) ELISA Kit
BSKM64910,Mouse Methyl CpG Binding Protein 2 (MECP2) ELISA Kit
BSKM64911,Mouse Maternal Embryonic Leucine Zipper Kinase (MELK) ELISA Kit
BSKM64912,Mouse Meteorin (METRN) ELISA Kit
BSKM64913,Mouse Melanoma Inhibitory Activity Protein 1 (MIA1) ELISA Kit
BSKM64914,Mouse Midline 1 (MID1) ELISA Kit
BSKD64915,Canine Macrophage Inflammatory Protein 1 Alpha (MIP1a) ELISA Kit
BSKD64916,Canine Macrophage Inflammatory Protein 3 Alpha (MIP3a) ELISA Kit
BSKD64917,Canine Macrophage Inflammatory Protein 3 Beta (MIP3b) ELISA Kit
BSKM64918,Mouse Matrix Metalloproteinase 14 (MMP14) ELISA Kit
BSKD64919,Canine Matrix Metalloproteinase 3 (MMP3) ELISA Kit
BSKI64920,Guinea pig Matrix Metalloproteinase 8 (MMP8) ELISA Kit
BSKD64921,Canine Matrix Metalloproteinase 9 (MMP9) ELISA Kit
BSKM64922,Mouse Multimerin 2 (MMRN2) ELISA Kit
BSKM64923,Mouse Mercaptopyruvate Sulfurtransferase (MPST) ELISA Kit
BSKM64924,Mouse Mesothelin (MSLN) ELISA Kit
BSKM64925,Mouse Microseminoprotein Beta (MSMb) ELISA Kit
BSKM64926,Mouse Methylthioadenosine Phosphorylase (MTAP) ELISA Kit
BSKM64927,Mouse Mitochondrial Methionyl tRNA Formyltransferase (MTFMT) ELISA Kit
BSKM64928,Mouse Myotubularin Related Protein 9 (MTMR9) ELISA Kit
BSKM64929,Mouse Myotrophin (MTPN) ELISA Kit
BSKM64930,Mouse Microsomal Triglyceride Transfer Protein (MTTP) ELISA Kit
BSKM64931,"Mouse Muscle, Skeletal, Receptor Tyrosine Kinase (MUSK) ELISA Kit"
BSKM64932,"Mouse Myosin Heavy Chain 4, Skeletal Muscle (MYH4) ELISA Kit"
BSKM64933,Mouse Myosin VA (MYO5A) ELISA Kit
BSKM64934,Mouse N-Acetylgalactosaminidase Alpha (NAGa) ELISA Kit
BSKM64935,Mouse N-Acetyltransferase 1 (NAT1) ELISA Kit
BSKM64936,Mouse N-Acetyltransferase 2 (NAT2) ELISA Kit
BSKM64937,Mouse Neurocan (NCAN) ELISA Kit
BSKM64938,Mouse Neurochondrin (NCDN) ELISA Kit
BSKM64939,Mouse Nucleolin (NCL) ELISA Kit
BSKM64940,"Mouse Neurofilament, Light Polypeptide (NEFL) ELISA Kit"
BSKM64941,Mouse Norepinephrine Transporter (NET) ELISA Kit
BSKM64942,Mouse Neurogenin 3 (NEUROG3) ELISA Kit
BSKM64943,Mouse Nuclear Factor I/B (NFIB) ELISA Kit
BSKM64944,Mouse Nuclear Factor I/X (NFIX) ELISA Kit
BSKM64945,Mouse NFKB Activating Protein (NKAP) ELISA Kit
BSKM64946,"Mouse Non Metastatic Cells 1, Protein NM23A Expressed In (NME1) ELISA Kit"
BSKM64947,Mouse Nicotinamide-N-Methyltransferase (NNMT) ELISA Kit
BSKM64948,Mouse Nodal Homolog (NODAL) ELISA Kit
BSKM64949,Mouse Noggin (NOG) ELISA Kit
BSKD64950,"Canine Nitric Oxide Synthase 2, Inducible (NOS2) ELISA Kit"
BSKM64951,Mouse Neuropeptide FF (NPFF) ELISA Kit
BSKM64952,Mouse Nephronectin (NPNT) ELISA Kit
BSKM64953,Mouse Neuropeptide Y Receptor Y1 (NPY1R) ELISA Kit
BSKM64954,Mouse Neuropeptide Y Receptor Y2 (NPY2R) ELISA Kit
BSKM64955,Mouse Neuropeptide Y Receptor Y5 (NPY5R) ELISA Kit
BSKM64956,"Mouse Nuclear Receptor Subfamily 1, Group D, Member 2 (NR1D2) ELISA Kit"
BSKM64957,Mouse Neuregulin 4 (NRG4) ELISA Kit
BSKM64958,Mouse Neuritin 1 (NRN1) ELISA Kit
BSKD64959,Canine N-Terminal Pro Brain Natriuretic Peptide (NT-ProBNP) ELISA Kit
BSKM64960,"Mouse Neurotensin Receptor 1, High Affinity (NTSR1) ELISA Kit"
BSKM64961,Mouse Nucleobindin 1 (NUCB1) ELISA Kit
BSKM64962,Mouse Nucleobindin 2 (NUCB2) ELISA Kit
BSKD64963,Canine Osteocalcin (OC) ELISA Kit
BSKM64964,Mouse Occludin (OCLN) ELISA Kit
BSKM64965,Mouse Oxoguanine Glycosylase 1 (OGG1) ELISA Kit
BSKM64966,Mouse Osteoglycin (OGN) ELISA Kit
BSKD64967,Canine Osteopontin (OPN) ELISA Kit
BSKM64968,Mouse Optineurin (OPTN) ELISA Kit
BSKM64969,Mouse Prolyl-4-Hydroxylase Alpha Polypeptide I (P4Ha1) ELISA Kit
BSKM64970,Mouse Platelet Activating Factor Acetylhydrolase 2 (PAFAH2) ELISA Kit
BSKM64971,Mouse Polyamine Oxidase (PAOX) ELISA Kit
BSKM64972,Mouse Poly ADP Ribose Polymerase (PARP) ELISA Kit
BSKM64973,Mouse Paired Box Gene 6 (PAX6) ELISA Kit
BSKM64974,Mouse Protocadherin 15 (PCDH15) ELISA Kit
BSKM64975,Mouse Pyruvate Carboxylase (PC) ELISA Kit
BSKM64976,Mouse Proprotein Convertase Subtilisin/Kexin Type 9 (PCSK9) ELISA Kit
BSKM64977,Mouse Prenylcysteine Oxidase 1 (PCYOX1) ELISA Kit
BSKM64978,Mouse Phosphodiesterase 12 (PDE12) ELISA Kit
BSKM64979,"Mouse Phosphodiesterase 1C, Calmodulin Dependent (PDE1C) ELISA Kit"
BSKM64980,"Mouse Phosphodiesterase 3A, cGMP Inhibited (PDE3A) ELISA Kit"
BSKM64981,Mouse Protein Disulfide Isomerase A4 (PDIA4) ELISA Kit
BSKM64982,Mouse Phosphoinositide Dependent Protein Kinase 1 (PDPK1) ELISA Kit
BSKM64983,Mouse Podoplanin (PDPN) ELISA Kit
BSKM64984,Mouse Phosphatidylethanolamine Binding Protein 1 (PEBP1) ELISA Kit
BSKM64985,Mouse Proenkephalin (PENK) ELISA Kit
BSKM64986,Mouse Peptidoglycan Recognition Protein 1 (PGLYRP1) ELISA Kit
BSKM64987,Mouse PHD Finger Protein 8 (PHF8) ELISA Kit
BSKM64988,Mouse Protein Kinase B Alpha (PKBa) ELISA Kit
BSKM64989,"Mouse Phospholipase A2, Group IIA (PLA2G2A) ELISA Kit"
BSKM64990,"Mouse Phospholipase A2, Group III (PLA2G3) ELISA Kit"
BSKM64991,Mouse Perilipin 4 (PLIN4) ELISA Kit
BSKM64992,Mouse Palate/Lung And Nasal Epithelium Associated Protein (PLUNC) ELISA Kit
BSKM64993,Mouse Peripheral Myelin Protein 22 (PMP22) ELISA Kit
BSKM64994,Mouse Podocan (PODN) ELISA Kit
BSKM64995,Mouse Paraoxonase 2 (PON2) ELISA Kit
BSKM64996,Mouse Periostin (POSTN) ELISA Kit
BSKM64997,Mouse Serine/Threonine-Protein Phosphatase 2A 56 kDa Regulatory Subunit Alpha Isoform (PP2Aa) ELISA Kit
BSKM64998,Mouse Peroxisome Proliferator Activated Receptor Delta (PPARd) ELISA Kit
BSKM64999,Mouse Peroxisome Proliferator Activated Receptor Gamma Coactivator 1 Alpha (PPARgC1a) ELISA Kit
BSKM65000,Mouse Periplakin (PPL) ELISA Kit
BSKM65001,"Mouse Protein Phosphatase 2A Activator, Regulatory Subunit 4 (PPP2R4) ELISA Kit"
BSKM65002,"Mouse Protein Phosphatase 3, Regulatory Subunit 1 (PPP3R1) ELISA Kit"
BSKM65003,Mouse Peroxiredoxin 1 (PRDX1) ELISA Kit
BSKM65004,Mouse Peroxiredoxin 4 (PRDX4) ELISA Kit
BSKM65005,Mouse Peroxiredoxin 6 (PRDX6) ELISA Kit
BSKM65006,"Mouse Protein Kinase, DNA Activated, Catalytic Polypeptide (PRKDC) ELISA Kit"
BSKM65007,"Mouse Protein Kinase, cGMP Dependent Type I (PRKG1) ELISA Kit"
BSKM65008,Mouse Peripherin (PRPH) ELISA Kit
BSKM65009,Mouse Persephin (PSPN) ELISA Kit
BSKD65010,Canine Parathyroid Hormone (PTH) ELISA Kit
BSKM65011,Mouse Parathymosin (PTMS) ELISA Kit
BSKM65012,"Mouse Protein Tyrosine Phosphatase, Non Receptor Type 11 (PTPN11) ELISA Kit"
BSKM65013,Mouse Quiescin Q6 Sulfhydryl Oxidase 1 (QSOX1) ELISA Kit
BSKM65014,"Mouse RAB5A, Member RAS Oncogene Family (RAB5A) ELISA Kit"
BSKM65015,Mouse DNA Repair Protein RAD50 (RAD50) ELISA Kit
BSKD65016,Canine Regulated On Activation In Normal T-Cell Expressed And Secreted (RANTES) ELISA Kit
BSKI65017,Guinea pig Regulated On Activation In Normal T-Cell Expressed And Secreted (RANTES) ELISA Kit
BSKM65018,Mouse Reticulocalbin 2 (RCN2) ELISA Kit
BSKM65019,Mouse Regenerating Islet Derived Protein 3 Alpha (REG3a) ELISA Kit
BSKM65020,Mouse Regenerating Islet Derived Protein 3 Beta (REG3b) ELISA Kit
BSKM65021,Mouse Regenerating Islet Derived Protein 3 Gamma (REG3g) ELISA Kit
BSKD65022,Canine Renin (REN) ELISA Kit
BSKM65023,Mouse Replication Initiator 1 (REPIN1) ELISA Kit
BSKM65024,Mouse Regulator Of G Protein Signaling 6 (RGS6) ELISA Kit
BSKM65025,Mouse Rhodopsin (RHO) ELISA Kit
BSKM65026,Mouse Reelin (RL) ELISA Kit
BSKM65027,Mouse Relaxin 3 (RLN3) ELISA Kit
BSKM65028,Mouse Renalase (RNLS) ELISA Kit
BSKM65029,"Mouse C-Ros Oncogene 1, Receptor Tyrosine Kinase (ROS1) ELISA Kit"
BSKM65030,Mouse Ribonucleotide Reductase M1 (RRM1) ELISA Kit
BSKM65031,Mouse Retinoid X Receptor Alpha (RXRa) ELISA Kit
BSKM65032,"Mouse Ryanodine Receptor 1, Skeletal (RYR1) ELISA Kit"
BSKM65033,Mouse S100 Calcium Binding Protein A4 (S100A4) ELISA Kit
BSKM65034,Mouse Sphingosine 1 Phosphate Receptor 1 (S1PR1) ELISA Kit
BSKM65035,Mouse Spermidine/Spermine N1-Acetyltransferase 1 (SAT1) ELISA Kit
BSKM65036,Mouse Scavenger Receptor Class A Member 3 (SCARA3) ELISA Kit
BSKD65037,Canine Stem Cell Factor (SCF) ELISA Kit
BSKM65038,Mouse Secretogranin II (SCG2) ELISA Kit
BSKM65039,Mouse Secretagogin (SCGN) ELISA Kit
BSKM65040,Mouse Succinate Dehydrogenase Complex Subunit A (SDHA) ELISA Kit
BSKM65041,Mouse Succinate Dehydrogenase Complex Subunit B (SDHB) ELISA Kit
BSKM65042,Mouse Succinate Dehydrogenase Complex Subunit C (SDHC) ELISA Kit
BSKM65043,Mouse Succinate Dehydrogenase Complex Subunit D (SDHD) ELISA Kit
BSKD65044,"Canine Selectin, Endothelium (SELE) ELISA Kit"
BSKM65045,Mouse Serotonin Transporter (SERT) ELISA Kit
BSKM65046,Mouse Sestrin 1 (SESN1) ELISA Kit
BSKM65047,Mouse Sestrin 2 (SESN2) ELISA Kit
BSKM65048,Mouse Sestrin 3 (SESN3) ELISA Kit
BSKM65049,Mouse Secreted Frizzled Related Protein 1 (SFRP1) ELISA Kit
BSKM65050,Mouse Secreted Frizzled Related Protein 2 (SFRP2) ELISA Kit
BSKM65051,Mouse Secreted Frizzled Related Protein 4 (SFRP4) ELISA Kit
BSKM65052,Mouse Secreted Frizzled Related Protein 5 (SFRP5) ELISA Kit
BSKM65053,Mouse Sideroflexin 1 (SFXN1) ELISA Kit
BSKM65054,Mouse Sodium/Glucose Cotransporter 1 (SGLT1) ELISA Kit
BSKM65055,Mouse Sphingosine 1 Phosphate Lyase 1 (SGPL1) ELISA Kit
BSKM65056,Mouse Sphingosine-1-Phosphate Phosphatase 2 (SGPP2) ELISA Kit
BSKM65057,"Mouse Sialidase 2, Cytosolic (SIAL2) ELISA Kit"
BSKM65058,Mouse Sirtuin 1 (SIRT1) ELISA Kit
BSKM65059,Mouse Sirtuin 3 (SIRT3) ELISA Kit
BSKM65060,Mouse Sirtuin 6 (SIRT6) ELISA Kit
BSKM65061,"Mouse Solute Carrier Family 30, Member 1 (SLC30A1) ELISA Kit"
BSKM65062,"Mouse Solute Carrier Family 30, Member 3 (SLC30A3) ELISA Kit"
BSKM65063,Mouse Solute Carrier Family 30 Member 4 (SLC30A4) ELISA Kit
BSKM65064,"Mouse Solute Carrier Family 30, Member 5 (SLC30A5) ELISA Kit"
BSKM65065,"Mouse Solute Carrier Family 30, Member 6 (SLC30A6) ELISA Kit"
BSKM65066,Mouse Solute Carrier Family 30 Member 7 (SLC30A7) ELISA Kit
BSKM65067,Mouse Slit Homolog 1 (Slit1) ELISA Kit
BSKM65068,Mouse Slit Homolog 3 (Slit3) ELISA Kit
BSKM65069,Mouse Mothers Against Decapentaplegic Homolog 2 (Smad2) ELISA Kit
BSKM65070,Mouse Mothers Against Decapentaplegic Homolog 3 (Smad3) ELISA Kit
BSKM65071,Mouse Spermine Oxidase (SMOX) ELISA Kit
BSKM65072,Mouse Synaptosomal Associated Protein 25kDa (SNAP25) ELISA Kit
BSKM65073,Mouse Suppressors Of Cytokine Signaling 1 (SOCS1) ELISA Kit
BSKM65074,Mouse Suppressors Of Cytokine Signaling 2 (SOCS2) ELISA Kit
BSKM65075,Mouse Sortilin 1 (SORT1) ELISA Kit
BSKM65076,Mouse Sclerostin Domain Containing Protein 1 (SOSTDC1) ELISA Kit
BSKM65077,Mouse Sclerostin (SOST) ELISA Kit
BSKD65078,Canine Surfactant Associated Protein A (SPA) ELISA Kit
BSKM65079,Mouse Serine Peptidase Inhibitor Kazal Type 5 (SPINK5) ELISA Kit
BSKM65080,Mouse Spondin 2 (SPON2) ELISA Kit
BSKM65081,Mouse Sepiapterin Reductase (SPR) ELISA Kit
BSKM65082,"Mouse Serine Palmitoyltransferase, Long Chain Base Subunit 1 (SPTLC1) ELISA Kit"
BSKM65083,"Mouse Serine Palmitoyltransferase, Long Chain Base Subunit 2 (SPTLC2) ELISA Kit"
BSKM65084,"Mouse Serine Palmitoyltransferase, Long Chain Base Subunit 3 (SPTLC3) ELISA Kit"
BSKM65085,Mouse Serine/Arginine Rich Splicing Factor 4 (SRSF4) ELISA Kit
BSKM65086,Mouse Sjogren Syndrome Antigen B (SSB) ELISA Kit
BSKM65087,Mouse Syntenin 2 (ST2) ELISA Kit
BSKM65088,Mouse Stanniocalcin 1 (STC1) ELISA Kit
BSKM65089,Mouse Serine/Threonine Kinase 11 (STK11) ELISA Kit
BSKM65090,"Mouse Syntaxin 1A, Brain (STX1A) ELISA Kit"
BSKM65091,Mouse Syntaxin 2 (STX2) ELISA Kit
BSKM65092,Mouse Sulfatase 2 (SULF2) ELISA Kit
BSKM65093,Mouse Sulfite Oxidase (SUOX) ELISA Kit
BSKM65094,Mouse Survivin (Surv) ELISA Kit
BSKM65095,Mouse Synapsin I (SYN1) ELISA Kit
BSKM65096,Mouse Synaptopodin 2 (SYNPO2) ELISA Kit
BSKM65097,Mouse TATA Box Binding Protein Associated Factor 12 (TAF12) ELISA Kit
BSKM65098,Mouse Taste Receptor Type 1 Member 2 (TAS1R2) ELISA Kit
BSKR65099,Rat Taste Receptor Type 1 Member 2 (TAS1R2) ELISA Kit
BSKM65100,Mouse Taurine Transporter (TAUT) ELISA Kit
BSKM65101,"Mouse Transcription Factor A, Mitochondrial (TFAM) ELISA Kit"
BSKM65102,Mouse Thrombospondin 2 (THBS2) ELISA Kit
BSKM65103,Mouse Thrombospondin 3 (THBS3) ELISA Kit
BSKM65104,Mouse Thrombospondin 4 (THBS4) ELISA Kit
BSKD65105,Canine Tissue Inhibitors Of Metalloproteinase 1 (TIMP1) ELISA Kit
BSKD65106,Canine Tissue Inhibitors Of Metalloproteinase 2 (TIMP2) ELISA Kit
BSKM65107,Mouse Transmembrane Protein 27 (TMEM27) ELISA Kit
BSKM65108,Mouse Tropomodulin 3 (TMOD3) ELISA Kit
BSKM65109,"Mouse Transmembrane Protease, Serine 2 (TMPRSS2) ELISA Kit"
BSKM65110,"Mouse Troponin I Type 2, Fast Skeletal (TNNI2) ELISA Kit"
BSKM65111,"Mouse Troponin T Type 1, Slow Skeletal (TNNT1) ELISA Kit"
BSKM65112,"Mouse Troponin T Type 2, Cardiac (TNNT2) ELISA Kit"
BSKM65113,Mouse Transportin 1 (TNPO1) ELISA Kit
BSKM65114,Mouse Topoisomerase I (TOP1) ELISA Kit
BSKM65115,Mouse Tumor Protein P63 (TP63) ELISA Kit
BSKM65116,Mouse Tryptophan Hydroxylase 1 (TPH1) ELISA Kit
BSKM65117,Mouse Tryptophan Hydroxylase 2 (TPH2) ELISA Kit
BSKM65118,Mouse Triosephosphate Isomerase 1 (TPI1) ELISA Kit
BSKM65119,Mouse Tropomyosin 2 Beta (TPM2) ELISA Kit
BSKD65120,Canine Thrombopoietin (TPO) ELISA Kit
BSKM65121,Mouse Tripeptidyl Peptidase I (TPP1) ELISA Kit
BSKM65122,Mouse Tryptase Beta 2 (TPSb2) ELISA Kit
BSKM65123,"Mouse Tumor Protein, Translationally Controlled 1 (TPT1) ELISA Kit"
BSKM65124,Mouse Trehalase (TREH) ELISA Kit
BSKM65125,Mouse Triggering Receptor Expressed On Myeloid Cells 2 (TREM2) ELISA Kit
BSKM65126,Mouse Thyroid Hormone Receptor Interactor 6 (TRIP6) ELISA Kit
BSKM65127,"Mouse Transient Receptor Potential Cation Channel Subfamily M, Member 4 (TRPM4) ELISA Kit"
BSKM65128,"Mouse Transient Receptor Potential Cation Channel Subfamily M, Member 6 (TRPM6) ELISA Kit"
BSKM65129,"Mouse Transient Receptor Potential Cation Channel Subfamily M, Member 7 (TRPM7) ELISA Kit"
BSKM65130,"Mouse Transient Receptor Potential Cation Channel Subfamily V, Member 1 (TRPV1) ELISA Kit"
