sku,description
BSKP61737,Porcine Insulin Like Growth Factor Binding Protein 1 (IGFBP1) ELISA Kit
BSKB61738,Bovine Insulin Like Growth Factor Binding Protein 2 (IGFBP2) ELISA Kit
BSKP61739,Porcine Insulin Like Growth Factor Binding Protein 2 (IGFBP2) ELISA Kit
BSKB61740,Bovine Insulin Like Growth Factor Binding Protein 3 (IGFBP3) ELISA Kit
BSKP61741,Porcine Insulin Like Growth Factor Binding Protein 3 (IGFBP3) ELISA Kit
BSKB61742,Bovine Insulin Like Growth Factor Binding Protein 4 (IGFBP4) ELISA Kit
BSKP61743,Porcine Insulin Like Growth Factor Binding Protein 4 (IGFBP4) ELISA Kit
BSKB61744,Bovine Insulin Like Growth Factor Binding Protein 6 (IGFBP6) ELISA Kit
BSKB61745,Bovine Interleukin 10 (IL10) ELISA Kit
BSKP61746,Porcine Interleukin 10 (IL10) ELISA Kit
BSKP61747,Porcine Interleukin 12A (IL12A) ELISA Kit
BSKB61748,Bovine Interleukin 12A (IL12A) ELISA Kit
BSKB61749,Bovine Interleukin 13 (IL13) ELISA Kit
BSKP61750,Porcine Interleukin 13 (IL13) ELISA Kit
BSKB61751,Bovine Interleukin 15 (IL15) ELISA Kit
BSKP61752,Porcine Interleukin 15 (IL15) ELISA Kit
BSKB61753,Bovine Interleukin 16 (IL16) ELISA Kit
BSKP61754,Porcine Interleukin 16 (IL16) ELISA Kit
BSKB61755,Bovine Interleukin 17 (IL17) ELISA Kit
BSKP61756,Porcine Interleukin 17 (IL17) ELISA Kit
BSKB61757,Bovine Interleukin 18 (IL18) ELISA Kit
BSKP61758,Porcine Interleukin 18 (IL18) ELISA Kit
BSKB61759,Bovine Interleukin 1 Alpha (IL1a) ELISA Kit
BSKP61760,Porcine Interleukin 1 Alpha (IL1a) ELISA Kit
BSKB61761,Bovine Interleukin 1 Beta (IL1b) ELISA Kit
BSKP61762,Porcine Interleukin 1 Beta (IL1b) ELISA Kit
BSKB61763,Bovine Interleukin 1 Receptor Antagonist (IL1RA) ELISA Kit
BSKB61764,Bovine Interleukin 2 (IL2) ELISA Kit
BSKG61765,Goat Interleukin 2 (IL2) ELISA Kit
BSKP61766,Porcine Interleukin 2 (IL2) ELISA Kit
BSKB61767,Bovine Interleukin 4 (IL4) ELISA Kit
BSKP61768,Porcine Interleukin 4 (IL4) ELISA Kit
BSKB61769,Bovine Interleukin 5 (IL5) ELISA Kit
BSKP61770,Porcine Interleukin 5 (IL5) ELISA Kit
BSKB61771,Bovine Interleukin 6 (IL6) ELISA Kit
BSKP61772,Porcine Interleukin 6 (IL6) ELISA Kit
BSKB61773,Bovine Interferon Gamma Induced Protein 10kDa (IP10) ELISA Kit
BSKB61774,Bovine Nerve Growth Factor (NGF) ELISA Kit
BSKP61775,Porcine Nerve Growth Factor (NGF) ELISA Kit
BSKB61776,Bovine Placenta Growth Factor (PLGF) ELISA Kit
BSKB61777,Bovine Transforming Growth Factor Beta 1 (TGFb1) ELISA Kit
BSKP61778,Porcine Transforming Growth Factor Beta 1 (TGFb1) ELISA Kit
BSKB61779,Bovine Transforming Growth Factor Beta 2 (TGFb2) ELISA Kit
BSKP61780,Porcine Transforming Growth Factor Beta 2 (TGFb2) ELISA Kit
BSKB61781,Bovine Transforming Growth Factor Beta Induced Protein (TGFbI) ELISA Kit
BSKP61782,Porcine Transforming Growth Factor Beta Induced Protein (TGFbI) ELISA Kit
BSKB61783,Bovine Tumor Necrosis Factor Beta (TNFb) ELISA Kit
BSKP61784,Porcine Tumor Necrosis Factor Beta (TNFb) ELISA Kit
BSKP61785,Porcine Vascular Endothelial Growth Factor A (VEGFA) ELISA Kit
BSKB61786,Bovine Vascular Endothelial Growth Factor B (VEGFB) ELISA Kit
BSKB61787,Bovine Vascular Endothelial Growth Factor D (VEGFD) ELISA Kit
BSKR61788,"Rat ATPase, H+/K+ Exchanging Alpha Polypeptide (ATP4a) ELISA Kit"
BSKR61789,Rat Endothelin 2 (EDN2) ELISA Kit
BSKR61790,Rat Fibroblast Growth Factor 11 (FGF11) ELISA Kit
BSKR61791,Rat Fibroblast Growth Factor 12 (FGF12) ELISA Kit
BSKR61792,Rat Fibroblast Growth Factor 13 (FGF13) ELISA Kit
BSKR61793,Rat Fibroblast Growth Factor 18 (FGF18) ELISA Kit
BSKR61794,Rat Fibroblast Growth Factor 19 (FGF19) ELISA Kit
BSKR61795,Rat Fibroblast Growth Factor 21 (FGF21) ELISA Kit
BSKR61796,Rat Fibroblast Growth Factor 3 (FGF3) ELISA Kit
BSKR61797,Rat Insulin Like Growth Factor Binding Protein 5 (IGFBP5) ELISA Kit
BSKR61798,Rat Interleukin 11 Receptor Alpha (IL11Ra) ELISA Kit
BSKR61799,Rat Interleukin 18 Binding Protein (IL18BP) ELISA Kit
BSKR61800,Rat Interleukin 20 (IL20) ELISA Kit
BSKR61801,Rat Interleukin 22 Receptor Alpha 2 (IL22Ra2) ELISA Kit
BSKR61802,Rat Interleukin 23 Receptor (IL23R) ELISA Kit
BSKR61803,Rat Interleukin 24 (IL24) ELISA Kit
BSKR61804,Rat Interleukin 34 (IL34) ELISA Kit
BSKR61805,Rat Interleukin 8 Receptor Beta (IL8Rb) ELISA Kit
BSKR61806,Rat Nerve Growth Factor IB (NGFIB) ELISA Kit
BSKR61807,Rat Platelet Derived Growth Factor Subunit B (PDGFB) ELISA Kit
BSKR61808,Rat Platelet Derived Growth Factor D (PDGFD) ELISA Kit
BSKR61809,Rat Platelet Derived Growth Factor Receptor Alpha (PDGFRa) ELISA Kit
BSKR61810,"Rat Tumor Necrosis Factor Ligand Superfamily, Member 12 (TNFSF12) ELISA Kit"
BSKH61811,Human Alpha-1-Antichymotrypsin (a1ACT) ELISA Kit
BSKH61812,Human Alpha-1-Antitrypsin (a1AT) ELISA Kit
BSKH61813,Human Arylalkylamine-N-Acetyltransferase (AANAT) ELISA Kit
BSKH61814,Human Alanine Aminopeptidase (AAP) ELISA Kit
BSKH61815,Human ATP Binding Cassette Transporter A1 (ABCA1) ELISA Kit
BSKH61816,Human ATP Binding Cassette Transporter G1 (ABCG1) ELISA Kit
BSKH61817,Human Acetyl Coenzyme A Carboxylase Alpha (ACACa) ELISA Kit
BSKH61818,Human Acetylcholinesterase (AchE) ELISA Kit
BSKH61819,Human Acrosin (ACR) ELISA Kit
BSKH61820,"Human Actin Alpha 1, Skeletal Muscle (ACTa1) ELISA Kit"
BSKH61821,Human Actin Beta (ACTb) ELISA Kit
BSKH61822,"Human Actin Gamma 2, Smooth Muscle (ACTg2) ELISA Kit"
BSKH61823,Human Actinin Alpha 3 (ACTN3) ELISA Kit
BSKH61824,Human Adenosine Deaminase (ADA) ELISA Kit
BSKH61825,Human A Disintegrin And Metalloprotease 9 (ADAM9) ELISA Kit
BSKH61826,Human A Disintegrin And Metalloproteinase With Thrombospondin 1 (ADAMTS1) ELISA Kit
BSKH61827,Human A Disintegrin And Metalloproteinase With Thrombospondin 7 (ADAMTS7) ELISA Kit
BSKH61828,"Human Adenylate Cyclase 10, Soluble (ADCY10) ELISA Kit"
BSKH61829,"Human Adenylate Cyclase 1, Brain (ADCY1) ELISA Kit"
BSKH61830,"Human Adenylate Cyclase 2, Brain (ADCY2) ELISA Kit"
BSKH61831,Human Adenylate Cyclase 5 (ADCY5) ELISA Kit
BSKH61832,"Human Adenylate Cyclase Activating Polypeptide 1, Pituitary (ADCYAP1) ELISA Kit"
BSKH61833,Human Adrenergic Receptor Alpha 1A (ADRa1A) ELISA Kit
BSKH61834,Human Adipose Differentiation Related Protein (ADRP) ELISA Kit
BSKH61835,Human Aggrecan (AGC) ELISA Kit
BSKH61836,Human Agrin (AGRN) ELISA Kit
BSKH61837,Human Agouti Related Protein (AGRP) ELISA Kit
BSKH61838,Human Aryl Hydrocarbon Receptor (AhR) ELISA Kit
BSKH61839,Human Apoptosis Inducing Factor (AIF) ELISA Kit
BSKH61840,Human Alpha-Lactalbumin (aLA) ELISA Kit
BSKH61841,"Human Aldehyde Dehydrogenase 7 Family, Member A1 (ALDH7A1) ELISA Kit"
BSKH61842,Human Activin Receptor Like Kinase 1 (ALK1) ELISA Kit
BSKH61843,Human Arachidonate-12-Lipoxygenase (ALOX12) ELISA Kit
BSKH61844,Human Arachidonate-5-Lipoxygenase (ALOX5) ELISA Kit
BSKH61845,"Human Alkaline Phosphatase, Intestinal (ALPI) ELISA Kit"
BSKH61846,"Human Alkaline Phosphatase, Liver/Bone/Kidney (ALPL) ELISA Kit"
BSKH61847,"Human Alkaline Phosphatase, Placental (ALPP) ELISA Kit"
BSKH61848,Human Angiomotin (AMOT) ELISA Kit
BSKH61849,"Human Amylase Alpha 1, Salivary (AMY1) ELISA Kit"
BSKH61850,"Human Amylase Alpha 2, Pancreatic (AMY2) ELISA Kit"
BSKH61851,Human Angiopoietin Like Protein 2 (ANGPTL2) ELISA Kit
BSKH61852,Human Angiopoietin Like Protein 3 (ANGPTL3) ELISA Kit
BSKH61853,Human Angiopoietin Like Protein 4 (ANGPTL4) ELISA Kit
BSKH61854,Human Annexin A2 (ANXA2) ELISA Kit
BSKH61855,Human Apelin 13 (AP13) ELISA Kit
BSKH61856,Human Apelin 36 (AP36) ELISA Kit
BSKH61857,Human Apoptotic Peptidase Activating Factor 1 (APAF1) ELISA Kit
BSKH61858,Human Apolipoprotein A4 (APOA4) ELISA Kit
BSKH61859,Human Apolipoprotein A5 (APOA5) ELISA Kit
BSKH61860,Human Apolipoprotein C2 (APOC2) ELISA Kit
BSKH61861,Human Apolipoprotein C3 (APOC3) ELISA Kit
BSKH61862,Human Apolipoprotein C4 (APOC4) ELISA Kit
BSKH61863,Human Apolipoprotein D (APOD) ELISA Kit
BSKH61864,Human Apolipoprotein F (APOF) ELISA Kit
BSKH61865,Human Amyloid Precursor Protein (APP) ELISA Kit
BSKH61866,Human Arginase (Arg) ELISA Kit
BSKH61867,Human Androgen Receptor (AR) ELISA Kit
BSKH61868,Human Arrestin Beta 2 (ARRb2) ELISA Kit
BSKH61869,Human Asialoglycoprotein Receptor 1 (ASGR1) ELISA Kit
BSKH61870,Human Apoptosis Signal Regulating Kinase 1 (ASK1) ELISA Kit
BSKH61871,Human Acid Sphingomyelinase (ASM) ELISA Kit
BSKH61872,Human Aspartate Aminotransferase (AST) ELISA Kit
BSKH61873,Human Activating Transcription Factor 4 (ATF4) ELISA Kit
BSKH61874,Human Activating Transcription Factor 6 (ATF6) ELISA Kit
BSKH61875,Human Ataxia Telangiectasia Mutated (ATM) ELISA Kit
BSKH61876,Human Arginine Vasopressin Receptor 1B (AVPR1B) ELISA Kit
BSKH61877,Human Azurocidin 1 (AZU1) ELISA Kit
BSKH61878,"Human Beta-1,3-Glucuronyltransferase 1 (b3GAT1) ELISA Kit"
BSKH61879,"Human Beta-1,4-Galactosyltransferase 1 (b4GALT1) ELISA Kit"
BSKH61880,Human B-Cell Activating Factor (BAFF) ELISA Kit
BSKH61881,Human Bcl2 Associated X Protein (Bax) ELISA Kit
BSKH61882,Human Major Basic Protein (MBP) ELISA Kit
BSKH61883,Human Bactericidal/Permeability Increasing Protein (BPI) ELISA Kit
BSKH61884,Human Breast And Kidney Expressed Chemokine (BRAK) ELISA Kit
BSKH61885,Human Breast Cancer Susceptibility Protein 1 (BRCA1) ELISA Kit
BSKH61886,Human Breast Cancer Susceptibility Protein 2 (BRCA2) ELISA Kit
BSKH61887,Human Bone Sialoprotein (BSP) ELISA Kit
BSKH61888,Human Bone Marrow Stromal Cell Antigen 1 (BST1) ELISA Kit
BSKH61889,Human Bone Marrow Stromal Cell Antigen 2 (BST2) ELISA Kit
BSKH61890,Human Bruton'S Tyrosine Kinase (Btk) ELISA Kit
BSKH61891,"Human Complement Component 1, Q Receptor (C1qR1) ELISA Kit"
BSKH61892,"Human Complement Component 1, R Subcomponent (C1r) ELISA Kit"
BSKH61893,"Human Complement Component 1, S Subcomponent (C1s) ELISA Kit"
BSKH61894,Human Complement Component 4b (C4b) ELISA Kit
BSKH61895,Human C4 Binding Protein Alpha (C4BPa) ELISA Kit
BSKH61896,Human Complement Component 5 (C5) ELISA Kit
BSKH61897,Human Complement Component 8g (C8g) ELISA Kit
BSKH61898,Human Complement Component 9 (C9) ELISA Kit
BSKM61899,Mouse Complement Component 9 (C9) ELISA Kit
BSKH61900,Human Carbohydrate Antigen 50 (CA50) ELISA Kit
BSKH61901,Human Caspase Activated DNase (CAD) ELISA Kit
BSKH61902,Human Caldesmon (CALD) ELISA Kit
BSKH61903,Human Calumenin (CALU) ELISA Kit
BSKH61904,Human Calcineurin (CaN) ELISA Kit
BSKH61905,Human Calpain 10 (CAPN10) ELISA Kit
BSKH61906,"Human Calpain 1, Large Subunit (CAPN1) ELISA Kit"
BSKH61907,Human Caspase 1 (CASP1) ELISA Kit
BSKH61908,Human Caspase 4 (CASP4) ELISA Kit
BSKH61909,Human Corticosteroid Binding Globulin (CBG) ELISA Kit
BSKH61910,"Human Cholecystokinin 8, Octapeptide (CCK8) ELISA Kit"
BSKH61911,Human Cholecystokinin B Receptor (CCKBR) ELISA Kit
BSKH61912,Human Chemokine C-C-Motif Ligand 14 (CCL14) ELISA Kit
BSKH61913,Human Chemokine C-C-Motif Receptor 1 (CCR1) ELISA Kit
BSKH61914,Human Chemokine C-C-Motif Receptor 7 (CCR7) ELISA Kit
BSKH61915,Human Cluster Of Differentiation 109 (CD109) ELISA Kit
BSKH61916,Human Cluster Of Differentiation (CD163) ELISA Kit
BSKH61917,Human Cluster Of Differentiation 19 (CD19) ELISA Kit
BSKH61918,Human Cluster Of Differentiation 226 (CD226) ELISA Kit
BSKH61919,Human Cluster Of Differentiation 24 (CD24) ELISA Kit
BSKH61920,Human Cluster Of Differentiation 34 (CD34) ELISA Kit
BSKH61921,Human Cluster Of Differentiation 3d (CD3d) ELISA Kit
BSKH61922,Human Cluster Of Differentiation 4 (CD4) ELISA Kit
BSKH61923,Human Protectin (CD59) ELISA Kit
BSKH61924,Human Cluster Of Differentiation 72 (CD72) ELISA Kit
BSKH61925,Human Cluster Of Differentiation 83 (CD83) ELISA Kit
BSKH61926,Human Cluster Of Differentiation 99 (CD99) ELISA Kit
BSKH61927,Human CUB Domain Containing Protein 1 (CDCP1) ELISA Kit
BSKH61928,Human Cadherin 16 (CDH16) ELISA Kit
BSKH61929,"Human Cadherin, Neuronal (CDH2) ELISA Kit"
BSKH61930,"Human Cadherin, Heart (CDHH) ELISA Kit"
BSKH61931,"Human Cadherin, Osteoblast (CDHOB) ELISA Kit"
BSKH61932,Human Cyclin Dependent Kinase 1 (CDK1) ELISA Kit
BSKH61933,Human Cyclin Dependent Kinase 2 (CDK2) ELISA Kit
BSKH61934,Human Cyclin Dependent Kinase 4 (CDK4) ELISA Kit
BSKH61935,Human Complement Factor I (CFI) ELISA Kit
BSKH61936,"Human Cofilin 1, Non Muscle (CFL1) ELISA Kit"
BSKH61937,"Human Cofilin 2, Muscle (CFL2) ELISA Kit"
BSKH61938,Human Chorionic Gonadotropin Alpha Polypeptide (CGa) ELISA Kit
BSKH61939,Human Choline Acetyltransferase (ChAT) ELISA Kit
BSKH61940,Human Chromogranin A (CHGA) ELISA Kit
BSKH61941,"Human Cholinergic Receptor, Muscarinic 2 (CHRM2) ELISA Kit"
BSKH61942,"Human Cholinergic Receptor, Nicotinic, Beta 2 (CHRNb2) ELISA Kit"
BSKH61943,Human Citrate Synthase (CS) ELISA Kit
BSKH61944,"Human C-Type Lectin Domain Family 2, Member C (CLEC2C) ELISA Kit"
BSKH61945,Human Contactin 1 (CNTN1) ELISA Kit
BSKH61946,Human Cartilage Oligomeric Matrix Protein (COMP) ELISA Kit
BSKH61947,"Human Complement Receptor 1, Erythrocyte (CR1) ELISA Kit"
BSKH61948,Human Calreticulin (CRT) ELISA Kit
BSKH61949,Human Cystathionine Gamma Lyase (CSE) ELISA Kit
BSKH61950,Human Catenin Beta 1 (CTNNb1) ELISA Kit
BSKH61951,Human Cathepsin D (CTSD) ELISA Kit
BSKH61952,Human Cathepsin S (CTSS) ELISA Kit
BSKH61953,Human Cytovillin (CVL) ELISA Kit
BSKH61954,Human Connexin 26 (CX26) ELISA Kit
BSKH61955,Human Connexin 37 (CX37) ELISA Kit
BSKH61956,Human Chemokine C-X3-C-Motif Receptor 1 (CX3CR1) ELISA Kit
BSKH61957,Human Connexin 40 (CX40) ELISA Kit
BSKH61958,Human Chemokine C-X-C-Motif Receptor 7 (CXCR7) ELISA Kit
BSKH61959,Human Cytokeratin Fragment Antigen 21-1 (CYFRA21-1) ELISA Kit
BSKH61960,Human Cytochrome P450 7A1 (CYP7A1) ELISA Kit
BSKH61961,Human Cysteinyl Leukotriene Receptor 2 (CYSLTR2) ELISA Kit
BSKH61962,Human Duffy Blood Group Chemokine Receptor (DARC) ELISA Kit
BSKH61963,Human Dopamine Transporter (DAT) ELISA Kit
BSKH61964,Human Dopamine Beta Hydroxylase (DbH) ELISA Kit
BSKH61965,Human Vitamin D Binding Protein (DBP) ELISA Kit
BSKH61966,Human Dopachrome Tautomerase (DCT) ELISA Kit
BSKH61967,"Human Defensin Alpha 1, Neutrophil (DEFa1) ELISA Kit"
BSKH61968,"Human Defensin Alpha 5, Paneth Cell Specific (DEFa5) ELISA Kit"
BSKH61969,Human Defensin Beta 1 (DEFb1) ELISA Kit
BSKH61970,Human Dickkopf Related Protein 2 (DKK2) ELISA Kit
BSKH61971,Human Dystrophin (DMD) ELISA Kit
BSKH61972,Human Deoxyribonuclease I (DNASE1) ELISA Kit
BSKH61973,Human Dynamin 1 (DNM1) ELISA Kit
BSKH61974,Human Dynamin 2 (DNM2) ELISA Kit
BSKH61975,Human Dopamine Receptor D1 (DRD1) ELISA Kit
BSKH61976,Human Big Dynorphin (Dyn) ELISA Kit
BSKM61977,Mouse Big Dynorphin (Dyn) ELISA Kit
BSKH61978,"Human Elastase 1, Pancreatic (ELA1) ELISA Kit"
BSKH61979,Human Elastase 4 (ELA4) ELISA Kit
BSKH61980,Human Elastin (ELN) ELISA Kit
BSKH61981,Human Extracellular Matrix Metalloproteinase Inducer (EMMPRIN) ELISA Kit
BSKH61982,Human Enkephalin (ENK) ELISA Kit
BSKH61983,Human Ectonucleoside Triphosphate Diphosphohydrolase 1 (ENTPD1) ELISA Kit
BSKH61984,Human Epithelial Cell Adhesion Molecule (EPCAM) ELISA Kit
BSKH61985,Human Ephrin Type A Receptor 1 (EPHA1) ELISA Kit
BSKH61986,Human Estrogen Receptor Alpha (ERa) ELISA Kit
BSKH61987,Human Epiregulin (EREG) ELISA Kit
BSKH61988,Human Extracellular Signal Regulated Kinase 1 (ERK1) ELISA Kit
BSKH61989,Human Endothelin Receptor A (ETRA) ELISA Kit
BSKH61990,Human Endothelin Receptor B (ETRB) ELISA Kit
BSKH61991,Human Coagulation Factor XI (F11) ELISA Kit
BSKH61992,Human Coagulation Factor XIII A1 Polypeptide (F13A1) ELISA Kit
BSKH61993,Human Coagulation Factor VII (F7) ELISA Kit
BSKH61994,Human Coagulation Factor VIII (F8) ELISA Kit
BSKH61995,"Human Fatty Acid Binding Protein 1, Liver (FABP1) ELISA Kit"
BSKH61996,"Human Fatty Acid Binding Protein 3, Muscle And Heart (FABP3) ELISA Kit"
BSKH61997,"Human Fatty Acid Binding Protein 4, Adipocyte (FABP4) ELISA Kit"
BSKH61998,"Human Fatty Acid Binding Protein 5, Epidermal (FABP5) ELISA Kit"
BSKH61999,"Human Fatty Acid Binding Protein 7, Brain (FABP7) ELISA Kit"
BSKH62000,Human Fatty Acid Transport Protein 5 (FATP5) ELISA Kit
BSKH62001,Human Fc Fragment Of IgA Receptor (FcaR) ELISA Kit
BSKH62002,Human Fc Fragment Of IgG Low Affinity IIIa Receptor (FcgR3A) ELISA Kit
BSKH62003,Human Fc Fragment Of IgG Low Affinity IIIb Receptor (FcgR3B) ELISA Kit
BSKH62004,Human Receptor I For The Fc Region Of Immunoglobulin G (FcgRI) ELISA Kit
BSKH62005,Human Receptor II For The Fc Region Of Immunoglobulin G (FcgRII) ELISA Kit
BSKH62006,Human Ficolin 2 (FCN2) ELISA Kit
BSKH62007,Human Ficolin 3 (FCN3) ELISA Kit
BSKH62008,Human Fetuin B (FETUB) ELISA Kit
BSKH62009,Human Fibrinogen Alpha (FGa) ELISA Kit
BSKH62010,Human Fibrinogen Beta (FGb) ELISA Kit
BSKH62011,Human Fibromodulin (FMOD) ELISA Kit
BSKH62012,Human V-Fos FBJ Murine Osteosarcoma Viral Oncogene Homolog (FOS) ELISA Kit
BSKH62013,Human Forkhead Box Protein P3 (FOXP3) ELISA Kit
BSKH62014,Human Formyl Peptide Receptor 1 (FPR1) ELISA Kit
BSKH62015,Human Formyl Peptide Receptor 2 (FPR2) ELISA Kit
BSKH62016,Human FK506 Binding Protein 12 Rapamycin Associated Protein (FRAP) ELISA Kit
BSKH62017,Human Fascin (FSCN) ELISA Kit
BSKH62018,Human Fucosyltransferase 4 (FUT4) ELISA Kit
BSKH62019,"Human Glutamate Decarboxylase 2, Acid (GAD2) ELISA Kit"
BSKH62020,Human Galanin (GAL) ELISA Kit
BSKH62021,Human Growth Associated Protein 43 (GAP43) ELISA Kit
BSKH62022,Human Glyceraldehyde-3-Phosphate Dehydrogenase (GAPDH) ELISA Kit
BSKH62023,Human Glucagon (GC) ELISA Kit
BSKH62024,"Human Glutamate Cysteine Ligase, Modifier Subunit (GCLM) ELISA Kit"
BSKH62025,Human Growth Differentiation Factor 2 (GDF2) ELISA Kit
BSKH62026,Human GDP Dissociation Inhibitor 1 (GDI1) ELISA Kit
BSKH62027,Human Gamma-Glutamyltransferase 1 (gGT1) ELISA Kit
BSKH62028,Human Growth Hormone Inducible Transmembrane Protein (GHITM) ELISA Kit
BSKH62029,Human Growth Hormone Receptor (GHR) ELISA Kit
BSKH62030,Human Glucose Transporter 1 (GLUT1) ELISA Kit
BSKH62031,Human Glucose Transporter 3 (GLUT3) ELISA Kit
BSKH62032,Human Granulysin (GNLY) ELISA Kit
BSKH62033,Human Gonadotropin Releasing Hormone Receptor (GnRHR) ELISA Kit
BSKH62034,Human Glucose Oxidase (GOD) ELISA Kit
BSKH62035,"Human Glycoprotein Ib Alpha Polypeptide, Platelet (GP1Ba) ELISA Kit"
BSKH62036,"Human Glycoprotein 39, Cartilage (GP39) ELISA Kit"
BSKH62037,Human Platelet Membrane Glycoprotein IV (GP4) ELISA Kit
BSKH62038,"Human Glycoprotein V, Platelet (GP5) ELISA Kit"
BSKH62039,"Human Glycoprotein VI, Platelet (GP6) ELISA Kit"
BSKH62040,Human Golgi Protein 73 (GP73) ELISA Kit
BSKH62041,Human Glypican 1 (GPC1) ELISA Kit
BSKH62042,Human Glypican 2 (GPC2) ELISA Kit
BSKH62043,Human Glutathione Reductase (GR) ELISA Kit
BSKH62044,Human Glutamate Receptor Interacting Protein 1 (GRIP1) ELISA Kit
BSKH62045,Human Growth Regulated Oncogene Beta (GROb) ELISA Kit
BSKH62046,Human Growth Regulated Oncogene Gamma (GROg) ELISA Kit
BSKH62047,Human Glutathione S Transferase Alpha 2 (GSTa2) ELISA Kit
BSKH62048,Human Glutathione S Transferase Alpha 5 (GSTa5) ELISA Kit
BSKH62049,Human Glutathione S Transferase Pi (GSTp) ELISA Kit
BSKH62050,Human Gastrin (GT) ELISA Kit
BSKH62051,Human Glucuronidase Beta (GUSb) ELISA Kit
BSKH62052,Human Glycophorin A (GYPA) ELISA Kit
BSKH62053,Human Granzyme K (GZMK) ELISA Kit
BSKH62054,Human Hyaluronidase (HAase) ELISA Kit
BSKH62055,Human Histone Acetyltransferase 1 (HAT1) ELISA Kit
BSKH62056,Human High Density Lipoprotein (HDL) ELISA Kit
BSKH62057,Human Hepcidin (Hepc) ELISA Kit
BSKH62058,Human Hemojuvelin (HJV) ELISA Kit
BSKH62059,Human Hydroxymethylglutaryl Coenzyme A Synthase (HMGCS) ELISA Kit
BSKH62060,Human High Mobility Group Nucleosome Binding Domain Protein 1 (HMGN1) ELISA Kit
BSKH62061,Human Haptoglobin Related Protein (HPR) ELISA Kit
BSKH62062,Human 3-Beta-Hydroxysteroid Dehydrogenase Type 1 (HSD3b1) ELISA Kit
BSKH62063,Human Heat Shock 10kDa Protein 1 (HSP10) ELISA Kit
BSKH62064,Human Heat Shock 70kDa Protein 1A (HSPA1A) ELISA Kit
BSKH62065,Human Heat Shock 70kDa Protein 1 Like Protein (HSPA1L) ELISA Kit
BSKH62066,Human Integrin Associated Protein (IAP) ELISA Kit
BSKH62067,Human Intercellular Adhesion Molecule 4 (ICAM4) ELISA Kit
BSKH62068,Human Insulin Degrading Enzyme (IDE) ELISA Kit
BSKH62069,"Human Indoleamine-2,3-Dioxygenase (IDO) ELISA Kit"
BSKH62070,Human Inhibitory Subunit Of NF Kappa B Alpha (IkBa) ELISA Kit
BSKH62071,Human Inhibin Beta B (INHbB) ELISA Kit
BSKH62072,Human Involucrin (iNV) ELISA Kit
BSKH62073,Human Immune Receptor Expressed On Myeloid Cells 1 (IREM1) ELISA Kit
BSKH62074,Human Integrin Alpha 1 (ITGa1) ELISA Kit
BSKH62075,Human Integrin Alpha 2B (ITGa2B) ELISA Kit
BSKH62076,Human Integrin Alpha 2 (ITGa2) ELISA Kit
BSKH62077,Human Integrin Alpha 5 (ITGa5) ELISA Kit
BSKH62078,Human Integrin Alpha 6 (ITGa6) ELISA Kit
BSKH62079,Human Integrin Alpha M (ITGaM) ELISA Kit
BSKH62080,Human Integrin Alpha V (ITGaV) ELISA Kit
BSKH62081,Human Integrin Beta 1 (ITGb1) ELISA Kit
BSKH62082,Human Integrin Beta 3 (ITGb3) ELISA Kit
BSKH62083,Human Integrin Beta 4 (ITGb4) ELISA Kit
BSKH62084,Human Jagged 1 Protein (JAG1) ELISA Kit
BSKH62085,Human Junctional Adhesion Molecule 1 (JAM1) ELISA Kit
BSKH62086,Human V-Jun Sarcoma Virus 17 Oncogene Homolog (JUN) ELISA Kit
BSKH62087,Human Potassium Chloride Cotransporters 2 (KCC2) ELISA Kit
BSKH62088,Human Potassium Chloride Cotransporters 4 (KCC4) ELISA Kit
BSKH62089,Human Killer Cell Immunoglobulin Like Receptor 2DS4 (KIR2DS4) ELISA Kit
BSKH62090,Human Killer Cell Immunoglobulin Like Receptor 3DL1 (KIR3DL1) ELISA Kit
BSKH62091,"Human Kruppel Like Factor 4, Gut (KLF4) ELISA Kit"
BSKH62092,"Human Kruppel Like Factor 5, Intestinal (KLF5) ELISA Kit"
BSKH62093,Human Prekallikrein (PK) ELISA Kit
BSKH62094,Human Kininogen 1 (KNG1) ELISA Kit
BSKH62095,Human Keratin 10 (KRT10) ELISA Kit
BSKH62096,Human Keratin 13 (KRT13) ELISA Kit
BSKH62097,Human Keratin 17 (KRT17) ELISA Kit
BSKH62098,Human Keratin 18 (KRT18) ELISA Kit
BSKH62099,Human Keratin 19 (KRT19) ELISA Kit
BSKH62100,Human Keratin 20 (KRT20) ELISA Kit
BSKH62101,Human Leukocyte Associated Immunoglobulin Like Receptor 1 (LAIR1) ELISA Kit
BSKH62102,Human Lysosomal Associated Membrane Protein 1 (LAMP1) ELISA Kit
BSKH62103,Human Lysosomal Associated Membrane Protein 2 (LAMP2) ELISA Kit
BSKH62104,Human Lipopolysaccharide Binding Protein (LBP) ELISA Kit
BSKH62105,Human Lipocalin 1 (LCN1) ELISA Kit
BSKH62106,Human Lactate Dehydrogenase A (LDHA) ELISA Kit
BSKH62107,Human Lactate Dehydrogenase B (LDHB) ELISA Kit
BSKH62108,Human Low Density Lipoprotein Receptor (LDLR) ELISA Kit
BSKH62109,"Human Lectin Galactoside Binding, Soluble 3 Binding Protein (LGALS3BP) ELISA Kit"
BSKH62110,"Human Leukocyte Immunoglobulin Like Receptor Subfamily A, Member 3 (LILRA3) ELISA Kit"
BSKH62111,"Human Leukocyte Immunoglobulin Like Receptor Subfamily B, Member 4 (LILRB4) ELISA Kit"
BSKH62112,"Human Lipase, Hormone Sensitive (LIPE) ELISA Kit"
BSKH62113,Human Lectin Like Oxidized Low Density Lipoprotein Receptor 1 (LOX1) ELISA Kit
BSKH62114,Human Leucine Rich Alpha-2-Glycoprotein 1 (LRG1) ELISA Kit
BSKH62115,Human Low Density Lipoprotein Receptor Related Protein 1 (LRP1) ELISA Kit
BSKH62116,Human Low Density Lipoprotein Receptor Related Protein 8 (LRP8) ELISA Kit
BSKH62117,Human Lumican (LUM) ELISA Kit
BSKH62118,Human Lysozyme (LZM) ELISA Kit
BSKH62119,Human Mucosal Addressin Cell Adhesion Molecule 1 (MAdCAM1) ELISA Kit
BSKH62120,Human Microtubule Associated Protein 2 (MAP2) ELISA Kit
BSKH62121,Human Microtubule Associated Protein 4 (MAP4) ELISA Kit
BSKH62122,Human Mitogen Activated Protein Kinase 14 (MAPK14) ELISA Kit
BSKH62123,Human Microtubule Associated Protein Tau (MAPt) ELISA Kit
BSKH62124,Human Mannose Associated Serine Protease 1 (MASP1) ELISA Kit
BSKH62125,Human Mannose Binding Lectin (MBL) ELISA Kit
BSKH62126,Human Melanoma Cell Adhesion Molecule (MCAM) ELISA Kit
BSKH62127,Human Minichromosome Maintenance Deficient 2 (MCM2) ELISA Kit
BSKH62128,Human Membrane Cofactor Protein (MCP) ELISA Kit
BSKH62129,Human Melanoma Associated Chondroitin Sulfate Proteoglycan (MCSP) ELISA Kit
BSKH62130,Human Melanoma Associated ME20 (ME20M) ELISA Kit
BSKH62131,Human Matrix Extracellular Phosphoglycoprotein (MEPE) ELISA Kit
BSKH62132,Human Melanotransferrin (MFI2) ELISA Kit
BSKH62133,Human Matrix Gla Protein (MGP) ELISA Kit
BSKH62134,Human Major Histocompatibility Complex Class I G (MHCG) ELISA Kit
BSKH62135,Human Melanoma Derived Leucine Zipper Extra Nuclear Factor (MLZE) ELISA Kit
BSKH62136,Human Monocyte To Macrophage Differentiation Associated Protein (MMA) ELISA Kit
BSKH62137,Human Matrix Metalloproteinase 16 (MMP16) ELISA Kit
BSKH62138,Human Matrix Metalloproteinase 17 (MMP17) ELISA Kit
BSKH62139,Human Matrix Metalloproteinase 19 (MMP19) ELISA Kit
BSKH62140,Human Matrix Metalloproteinase 25 (MMP25) ELISA Kit
BSKH62141,Human Matrix Metalloproteinase 26 (MMP26) ELISA Kit
BSKH62142,Human Matrix Metalloproteinase 28 (MMP28) ELISA Kit
BSKH62143,Human Myeloid Progenitor Inhibitory Factor 1 (MPIF1) ELISA Kit
BSKH62144,Human Macrophage mannose receptor 1 (MRC1) ELISA Kit
BSKH62145,Human Motility Related Protein (MRP1) ELISA Kit
BSKH62146,"Human Membrane Spanning 4 Domains Subfamily A, Member 1 (MS4A1) ELISA Kit"
BSKH62147,Human Macrophage Stimulating Protein (MSP) ELISA Kit
BSKH62148,Human Macrophage Scavenger Receptor 1 (MSR1) ELISA Kit
BSKH62149,Human Myostatin (MSTN) ELISA Kit
BSKH62150,Human Metallothionein 1 (MT1) ELISA Kit
BSKH62151,Human Metallothionein 2 (MT2) ELISA Kit
BSKH62152,Human Mucin 3 (MUC3) ELISA Kit
BSKH62153,Human Mucin 4 (MUC4) ELISA Kit
BSKH62154,Human Mucin 6 (MUC6) ELISA Kit
BSKH62155,"Human Mucin 7, Secreted (MUC7) ELISA Kit"
BSKH62156,Human V-Myc Myelocytomatosis Viral Oncogene Homolog (MYC) ELISA Kit
BSKH62157,Human Myeloid Differentiation Factor 88 (MyD88) ELISA Kit
BSKH62158,"Human Myosin Light Chain 1, Alkali, Fast Skeletal (MYL1) ELISA Kit"
BSKH62159,"Human Myosin Light Chain 2, Regulatory, Cardiac (MYL2) ELISA Kit"
BSKH62160,Human Myosin Light Chain Kinase (MYLK) ELISA Kit
BSKH62161,Human Myogenic Differentiation (MyoD) ELISA Kit
BSKH62162,Human Myogenin (MYOG) ELISA Kit
BSKH62163,Human Neuronal Apoptosis Inhibitory Protein (NAIP) ELISA Kit
BSKH62164,Human Neural Cell Adhesion Molecule (NCAM) ELISA Kit
BSKH62165,Human Neurofilament 3 (NEF3) ELISA Kit
