sku,description
BSKR60001,Rat Albumin (ALB) ELISA Kit
BSKH60002,Human Interferon Gamma (IFNg) ELISA Kit
BSKH60003,Human Interferon Gamma Induced Protein 10kDa (IP10) ELISA Kit
BSKR60004,Rat Interleukin 4 (IL4) ELISA Kit
BSKH60005,Human Interleukin 4 (IL4) ELISA Kit
BSKR60006,"Rat Colony Stimulating Factor 2, Granulocyte Macrophage (GMCSF) ELISA Kit"
BSKM60007,Mouse Epidermal Growth Factor (EGF) ELISA Kit
BSKM60008,Mouse Adiponectin (ADP) ELISA Kit
BSKH60009,Human Epidermal Growth Factor (EGF) ELISA Kit
BSKH60010,"Human Colony Stimulating Factor 3, Granulocyte (GCSF) ELISA Kit"
BSKH60011,"Human Colony Stimulating Factor 2, Granulocyte Macrophage (GMCSF) ELISA Kit"
BSKH60012,Human Insulin Like Growth Factor 1 (IGF1) ELISA Kit
BSKM60013,Mouse Insulin Like Growth Factor 1 (IGF1) ELISA Kit
BSKM60014,Mouse Placenta Growth Factor (PLGF) ELISA Kit
BSKM60015,"Mouse Colony Stimulating Factor 3, Granulocyte (GCSF) ELISA Kit"
BSKI60017,Guinea pig Albumin (ALB) ELISA Kit
BSKM60018,Mouse B-Lymphocyte Chemoattractant 1 (BLC1) ELISA Kit
BSKR60019,Rat Insulin Like Growth Factor 1 (IGF1) ELISA Kit
BSKM60016,Mouse Interferon Gamma Induced Protein 10kDa (IP10) ELISA Kit
BSKH60020,Human Interleukin 15 (IL15) ELISA Kit
BSKR60021,Rat Interleukin 1 Alpha (IL1a) ELISA Kit
BSKH60022,Human Interleukin 1 Beta (IL1b) ELISA Kit
BSKM60023,Mouse Vascular Endothelial Growth Factor Receptor 1 (VEGFR1) ELISA Kit
BSKM60024,Mouse Interleukin 1 Receptor Antagonist (IL1RA) ELISA Kit
BSKM60025,Mouse Interleukin 22 (IL22) ELISA Kit
BSKM60026,Mouse Interleukin 23 (IL23) ELISA Kit
BSKD60027,Canine Interleukin 8 (IL8) ELISA Kit
BSKM60028,"Mouse Colony Stimulating Factor 1, Macrophage (MCSF) ELISA Kit"
BSKM60029,Mouse Vascular Endothelial Growth Factor Receptor 2 (VEGFR2) ELISA Kit
BSKH60030,Human B-Lymphocyte Chemoattractant 1 (BLC1) ELISA Kit
BSKH60031,Human Insulin Like Growth Factor Binding Protein 4 (IGFBP4) ELISA Kit
BSKM60032,Mouse Interleukin 2 (IL2) ELISA Kit
BSKH60033,Human Interferon Inducible T-Cell Alpha Chemoattractant (ITaC) ELISA Kit
BSKH60034,"Human Colony Stimulating Factor 1, Macrophage (MCSF) ELISA Kit"
BSKH60035,"Human Tumor Necrosis Factor Receptor Superfamily, Member 1A (TNFRSF1A) ELISA Kit"
BSKM60036,"Mouse Tumor Necrosis Factor Receptor Superfamily, Member 5 (TNFRSF5) ELISA Kit"
BSKM60037,Mouse Insulin Like Growth Factor Binding Protein 3 (IGFBP3) ELISA Kit
BSKM60038,Mouse Transforming Growth Factor Beta 1 (TGFb1) ELISA Kit
BSKH60039,"Human Tumor Necrosis Factor Receptor Superfamily, Member 1B (TNFRSF1B) ELISA Kit"
BSKH60040,Human Tumor Necrosis Factor Related Apoptosis Inducing Ligand (TRAIL) ELISA Kit
BSKM60041,Mouse Milk Fat Globule EGF Factor 8 (MFGE8) ELISA Kit
BSKM60042,Mouse Albumin (ALB) ELISA Kit
BSKH60043,Human Insulin Like Growth Factor Binding Protein 1 (IGFBP1) ELISA Kit
BSKH60044,Human Insulin Like Growth Factor Binding Protein 3 (IGFBP3) ELISA Kit
BSKM60045,Mouse Transferrin (TRF) ELISA Kit
BSKD60046,Canine Vascular Endothelial Growth Factor A (VEGFA) ELISA Kit
BSKH60047,"Human Fibroblast Growth Factor 1, Acidic (FGF1) ELISA Kit"
BSKH60048,Human Hepatocyte Growth Factor (HGF) ELISA Kit
BSKH60049,Human Thymic Stromal Lymphopoietin (TSLP) ELISA Kit
BSKH60050,Human Interleukin 8 (IL8) ELISA Kit
BSKH60051,Human Transforming Growth Factor Beta 1 (TGFb1) ELISA Kit
BSKH60052,Human Vascular Endothelial Growth Factor D (VEGFD) ELISA Kit
BSKH60053,Human Endocrine Gland Derived Vascular Endothelial Growth Factor (EG-VEGF) ELISA Kit
BSKH60054,Human Insulin Like Growth Factor Binding Protein 2 (IGFBP2) ELISA Kit
BSKH60055,Human Platelet Derived Growth Factor AA (PDGFAA) ELISA Kit
BSKM60056,Mouse Vascular Endothelial Growth Factor A (VEGFA) ELISA Kit
BSKH60057,Human Fibroblast Growth Factor 7 (FGF7) ELISA Kit
BSKR60058,Rat Interferon Gamma (IFNg) ELISA Kit
BSKH60059,Human Monokine Induced By Interferon Gamma (MIg) ELISA Kit
BSKH60060,Human Platelet Derived Growth Factor AB (PDGFAB) ELISA Kit
BSKH60061,Human Placenta Growth Factor (PLGF) ELISA Kit
BSKH60062,"Human Fibroblast Growth Factor 2, Basic (FGF2) ELISA Kit"
BSKH60063,Human Interleukin 20 (IL20) ELISA Kit
BSKH60064,Human Vascular Endothelial Growth Factor C (VEGFC) ELISA Kit
BSKH60065,Human Vascular Endothelial Growth Factor Receptor 1 (VEGFR1) ELISA Kit
BSKH60066,Human Insulin (INS) ELISA Kit
BSKH60067,Human Myoglobin (MYO) ELISA Kit
BSKD60068,Canine Transferrin (TRF) ELISA Kit
BSKH60069,Human Brain Derived Neurotrophic Factor (BDNF) ELISA Kit
BSKH60070,Human Albumin (ALB) ELISA Kit
BSKR60071,Rat Interleukin 2 (IL2) ELISA Kit
BSKH60072,Human Interferon Alpha (IFNa) ELISA Kit
BSKH60073,Human Interleukin 10 (IL10) ELISA Kit
BSKH60074,Human Interleukin 1 Zeta (IL1z) ELISA Kit
BSKH60075,Human Interleukin 2 (IL2) ELISA Kit
BSKH60076,Human Interleukin 6 (IL6) ELISA Kit
BSKH60077,Human Tumor Necrosis Factor Alpha (TNFa) ELISA Kit
BSKH60078,Human Vascular Endothelial Growth Factor 145 (VEGF145) ELISA Kit
BSKD60079,Canine Albumin (ALB) ELISA Kit
BSKH60080,Human Beta-2-Microglobulin (b2M) ELISA Kit
BSKH60081,Human Fibroblast Growth Factor 21 (FGF21) ELISA Kit
BSKH60082,Human Low Density Lipoprotein (LDL) ELISA Kit
BSKM60083,Mouse Interferon Alpha (IFNa) ELISA Kit
BSKM60084,Mouse Interleukin 10 (IL10) ELISA Kit
BSKM60085,Mouse Interleukin 1 Beta (IL1b) ELISA Kit
BSKM60086,Mouse Interleukin 6 (IL6) ELISA Kit
BSKM60087,Mouse Tumor Necrosis Factor Alpha (TNFa) ELISA Kit
BSKR60088,Rat Interferon Alpha (IFNa) ELISA Kit
BSKM60089,Mouse Erythropoietin (EPO) ELISA Kit
BSKH60090,Human Alpha-Fetoprotein (aFP) ELISA Kit
BSKH60091,Human Carcinoembryonic Antigen (CEA) ELISA Kit
BSKH60092,Human Matrix Metalloproteinase 2 (MMP2) ELISA Kit
BSKM60093,Mouse Osteopontin (OPN) ELISA Kit
BSKM60094,Mouse Resistin (RETN) ELISA Kit
BSKH60095,Human Transferrin (TRF) ELISA Kit
BSKM60096,Mouse Intercellular Adhesion Molecule 1 (ICAM1) ELISA Kit
BSKM60097,Mouse Lectin Like Oxidized Low Density Lipoprotein Receptor 1 (LOX1) ELISA Kit
BSKM60098,"Mouse Selectin, Leukocyte (SELL) ELISA Kit"
BSKM60099,"Mouse Selectin, Platelet (SELP) ELISA Kit"
BSKH60101,Human Renal Tumor Antigen (RAGE) ELISA Kit
BSKM60102,Mouse Stem Cell Factor (SCF) ELISA Kit
BSKM60100,Mouse Angiopoietin Like Protein 3 (ANGPTL3) ELISA Kit
BSKR60103,Rat Epidermal Growth Factor (EGF) ELISA Kit
BSKR60104,Rat Interleukin 1 Beta (IL1b) ELISA Kit
BSKO60105,Rabbit Interleukin 1 Beta (IL1b) ELISA Kit
BSKR60106,Rat Interleukin 6 (IL6) ELISA Kit
BSKR60107,Rat Tumor Necrosis Factor Alpha (TNFa) ELISA Kit
BSKO60108,Rabbit Tumor Necrosis Factor Alpha (TNFa) ELISA Kit
BSKR60109,Rat Growth Regulated Oncogene Beta (GROb) ELISA Kit
BSKH60110,Human Haptoglobin (Hpt) ELISA Kit
BSKM60111,Mouse Macrophage Inflammatory Protein 1 Beta (MIP1b) ELISA Kit
BSKH60112,Human Matrix Metalloproteinase 8 (MMP8) ELISA Kit
BSKM60113,"Mouse TEK Tyrosine Kinase, Endothelial (Tie2) ELISA Kit"
BSKH60114,Human Vascular Cell Adhesion Molecule 1 (VCAM1) ELISA Kit
BSKM60115,Mouse Vascular Cell Adhesion Molecule 1 (VCAM1) ELISA Kit
BSKH60116,Human Monocyte Chemotactic Protein 3 (MCP3) ELISA Kit
BSKH60117,Human Monocyte Chemotactic Protein 1 (MCP1) ELISA Kit
BSKR60118,Rat Neutrophil Activating Protein 3 (NAP3) ELISA Kit
BSKH60119,Human Osteopontin (OPN) ELISA Kit
BSKH60120,Human Stromal Cell Derived Factor 1 (SDF1) ELISA Kit
BSKH60121,Human Angiotensin I Converting Enzyme 2 (ACE2) ELISA Kit
BSKH60122,Human Complement Component 3 (C3) ELISA Kit
BSKH60123,Human Kallikrein 3 (KLK3) ELISA Kit
BSKM60124,Mouse Triggering Receptor Expressed On Myeloid Cells 1 (TREM1) ELISA Kit
BSKH60125,Human FMS Like Tyrosine Kinase 3 Ligand (Flt3L) ELISA Kit
BSKH60126,Human Macrophage Inflammatory Protein 1 Alpha (MIP1a) ELISA Kit
BSKH60127,"Human Selectin, Platelet (SELP) ELISA Kit"
BSKH60128,Human Ciliary Neurotrophic Factor (CNTF) ELISA Kit
BSKH60129,Human Cystatin 3 (CST3) ELISA Kit
BSKM60130,Mouse Endoglin (ENG) ELISA Kit
BSKR60131,Rat Galectin 1 (GAL1) ELISA Kit
BSKH60132,Human Macrophage Derived Chemokine (MDC) ELISA Kit
BSKH60133,Human Neutrophil Activating Protein 3 (NAP3) ELISA Kit
BSKH60134,Human Regulated On Activation In Normal T-Cell Expressed And Secreted (RANTES) ELISA Kit
BSKM60135,"Mouse Selectin, Endothelium (SELE) ELISA Kit"
BSKH60136,Human Tyrosine Kinase With Immunoglobulin Like And EGF Like Domains Protein 1 (Tie1) ELISA Kit
BSKR60137,Rat Tissue Inhibitors Of Metalloproteinase 1 (TIMP1) ELISA Kit
BSKH60138,Human Neutrophil Activating Protein 2 (NAP2) ELISA Kit
BSKH60139,Human Chemokine C-C-Motif Ligand 1 (CCL1) ELISA Kit
BSKH60140,"Human Cadherin, Epithelial (CDHE) ELISA Kit"
BSKH60141,Human Cutaneous T-Cell Attracting Chemokine (CTACK) ELISA Kit
BSKH60142,Human Chemokine C-X-C-Motif Ligand 16 (CXCL16) ELISA Kit
BSKH60143,Human Leukemia Inhibitory Factor (LIF) ELISA Kit
BSKH60144,Human Pulmonary Activation Regulated Chemokine (PARC) ELISA Kit
BSKH60145,Human Angiogenin (ANG) ELISA Kit
BSKH60146,"Human Selectin, Endothelium (SELE) ELISA Kit"
BSKH60147,Human Tissue Factor Pathway Inhibitor (TFPI) ELISA Kit
BSKH60148,Human Tissue Inhibitors Of Metalloproteinase 4 (TIMP4) ELISA Kit
BSKM60149,Mouse Clusterin (CLU) ELISA Kit
BSKH60150,Human Factor Related Apoptosis Ligand (FASL) ELISA Kit
BSKM60151,Mouse Factor Related Apoptosis Ligand (FASL) ELISA Kit
BSKH60152,Human Growth Hormone (GH) ELISA Kit
BSKH60153,Human Matrix Metalloproteinase 3 (MMP3) ELISA Kit
BSKM60154,Mouse Serum Amyloid P Component (SAP) ELISA Kit
BSKH60155,Human Stem Cell Factor (SCF) ELISA Kit
BSKH60156,Human Tissue Inhibitors Of Metalloproteinase 1 (TIMP1) ELISA Kit
BSKR60157,Rat Intercellular Adhesion Molecule 1 (ICAM1) ELISA Kit
BSKM60158,Mouse Monocyte Chemotactic Protein 5 (MCP5) ELISA Kit
BSKH60159,Human Macrophage Inflammatory Protein 3 Alpha (MIP3a) ELISA Kit
BSKH60160,Human Eosinophil Chemotactic Factor (ECF) ELISA Kit
BSKH60161,Human Epithelial Neutrophil Activating Peptide 78 (ENA78) ELISA Kit
BSKB60162,Bovine Fibronectin (FN) ELISA Kit
BSKH60163,Human Granulocyte Chemotactic Protein 2 (GCP2) ELISA Kit
BSKH60164,Human Matrix Metalloproteinase 7 (MMP7) ELISA Kit
BSKH60165,Human Stem Cell Factor Receptor (SCFR) ELISA Kit
BSKH60166,Human Carbonic Anhydrase IX (CA9) ELISA Kit
BSKM60167,Mouse Chemerin (CHEM) ELISA Kit
BSKH60168,Human C Reactive Protein (CRP) ELISA Kit
BSKM60169,Mouse Chemokine C-X3-C-Motif Ligand 1 (CX3CL1) ELISA Kit
BSKM60170,Mouse Dickkopf Related Protein 1 (DKK1) ELISA Kit
BSKM60171,Mouse FMS Like Tyrosine Kinase 3 Ligand (Flt3L) ELISA Kit
BSKR60172,Rat Growth Regulated Oncogene Gamma (GROg) ELISA Kit
BSKM60173,Mouse Macrophage Derived Chemokine (MDC) ELISA Kit
BSKM60174,Mouse Macrophage Inflammatory Protein 3 Alpha (MIP3a) ELISA Kit
BSKH60175,"Human TEK Tyrosine Kinase, Endothelial (Tie2) ELISA Kit"
BSKH60176,Human Complement Factor D (CFD) ELISA Kit
BSKM60177,Mouse Platelet Factor 4 (PF4) ELISA Kit
BSKH60178,Human Prolactin (PRL) ELISA Kit
BSKM60179,"Mouse Retinol Binding Protein 4, Plasma (RBP4) ELISA Kit"
BSKH60180,Human Thrombospondin 2 (THBS2) ELISA Kit
BSKH60181,Human Adiponectin (ADP) ELISA Kit
BSKH60182,Human Connective Tissue Growth Factor (CTGF) ELISA Kit
BSKH60183,Human Heparin Binding Epidermal Growth Factor Like Growth Factor (HBEGF) ELISA Kit
BSKH60184,Human Interferon Beta (IFNb) ELISA Kit
BSKH60185,Human Interleukin 18 (IL18) ELISA Kit
BSKD60186,Canine Interleukin 1 Beta (IL1b) ELISA Kit
BSKI60187,Guinea pig Interleukin 1 Beta (IL1b) ELISA Kit
BSKI60188,Guinea pig Interleukin 8 (IL8) ELISA Kit
BSKH60189,Human Kallikrein 10 (KLK10) ELISA Kit
BSKM60190,Mouse Matrix Metalloproteinase 9 (MMP9) ELISA Kit
BSKH60191,Human Nerve Growth Factor (NGF) ELISA Kit
BSKH60192,Human Survivin (Surv) ELISA Kit
BSKD60193,Canine Tumor Necrosis Factor Alpha (TNFa) ELISA Kit
BSKI60194,Guinea pig Tumor Necrosis Factor Alpha (TNFa) ELISA Kit
BSKH60195,Human Vascular Endothelial Growth Factor A (VEGFA) ELISA Kit
BSKH60199,Human A Disintegrin And Metalloprotease 12 (ADAM12) ELISA Kit
BSKH60200,Human Cathepsin V (CTSV) ELISA Kit
BSKH60201,Human Endoglin (ENG) ELISA Kit
BSKH60202,"Human Retinol Binding Protein 4, Plasma (RBP4) ELISA Kit"
BSKH60196,Human Angiopoietin 1 (ANGPT1) ELISA Kit
BSKH60197,Human Matrix Metalloproteinase 9 (MMP9) ELISA Kit
BSKH60198,Human SPARC Like Protein 1 (SPARCL1) ELISA Kit
BSKH60203,Human Cadherin 5 (CDH5) ELISA Kit
BSKH60204,Human Clusterin (CLU) ELISA Kit
BSKH60205,Human Intercellular Adhesion Molecule 1 (ICAM1) ELISA Kit
BSKH60206,Human Leptin (LEP) ELISA Kit
BSKH60207,Human Surfactant Associated Protein D (SPD) ELISA Kit
BSKM60208,Mouse Tissue Inhibitors Of Metalloproteinase 1 (TIMP1) ELISA Kit
BSKH60209,Human Macrophage Inflammatory Protein 4 Alpha (MIP4a) ELISA Kit
BSKM60210,Mouse Heparin Binding Epidermal Growth Factor Like Growth Factor (HBEGF) ELISA Kit
BSKM60211,Mouse Interferon Gamma (IFNg) ELISA Kit
BSKM60212,Mouse Interferon Inducible T-Cell Alpha Chemoattractant (ITaC) ELISA Kit
BSKM60213,Mouse Nerve Growth Factor (NGF) ELISA Kit
BSKH60214,Human Fibronectin (FN) ELISA Kit
BSKH60215,Human Follicle Stimulating Hormone (FSH) ELISA Kit
BSKH60216,Human Glucoprotein 130 (gp130) ELISA Kit
BSKH60217,Human C-Peptide ELISA Kit
BSKH60218,Human Receptor II For The Fc Region Of Immunoglobulin E (FceRII) ELISA Kit
BSKC60219,Chicken Netrin 1 (Ntn1) ELISA Kit
BSKH60220,Human Renin (REN) ELISA Kit
BSKH60221,Human Von Willebrand Factor Cleaving Protease (vWFCP) ELISA Kit
BSKH60222,Human Lactoferrin (LTF) ELISA Kit
BSKB60223,Bovine Interleukin 8 (IL8) ELISA Kit
BSKH60224,Human Allograft Inflammatory Factor 1 (AIF1) ELISA Kit
BSKH60225,Human Myeloid Progenitor Inhibitory Factor 2 (MPIF2) ELISA Kit
BSKH60226,Human Myeloperoxidase (MPO) ELISA Kit
BSKH60227,Human N-Terminal Pro Brain Natriuretic Peptide (NT-ProBNP) ELISA Kit
BSKH60228,Human Thyroid Stimulating Hormone (TSH) ELISA Kit
BSKH60229,Human Luteinizing Hormone (LH) ELISA Kit
BSKR60230,Rat Beta-Thromboglobulin (bTG) ELISA Kit
BSKH60231,Human Plasminogen Activator Inhibitor 1 (PAI1) ELISA Kit
BSKM60232,Mouse Alpha-2-Macroglobulin (a2M) ELISA Kit
BSKM60233,Mouse Carcinoembryonic Antigen (CEA) ELISA Kit
BSKM60234,Mouse Myeloid Progenitor Inhibitory Factor 2 (MPIF2) ELISA Kit
BSKM60235,Mouse Tissue Inhibitors Of Metalloproteinase 2 (TIMP2) ELISA Kit
BSKR60236,Rat Brain Derived Neurotrophic Factor (BDNF) ELISA Kit
BSKR60237,"Rat Fibroblast Growth Factor 2, Basic (FGF2) ELISA Kit"
BSKR60238,"Rat Colony Stimulating Factor 3, Granulocyte (GCSF) ELISA Kit"
BSKR60239,Rat Heparin Binding Epidermal Growth Factor Like Growth Factor (HBEGF) ELISA Kit
BSKR60240,Rat Interleukin 18 (IL18) ELISA Kit
BSKC60241,Chicken Interleukin 8 (IL8) ELISA Kit
BSKR60242,Rat Interferon Inducible T-Cell Alpha Chemoattractant (ITaC) ELISA Kit
BSKR60243,Rat Nerve Growth Factor (NGF) ELISA Kit
BSKR60244,Rat Vascular Endothelial Growth Factor A (VEGFA) ELISA Kit
BSKH60245,Human Corin (CRN) ELISA Kit
BSKL60246,General Cyclic Adenosine Monophosphate (cAMP) ELISA Kit
BSKH60247,Human A Disintegrin And Metalloprotease 17 (ADAM17) ELISA Kit
BSKH60248,Human Adiponectin Receptor 1 (ADIPOR1) ELISA Kit
BSKH60249,Human Adiponectin Receptor 2 (ADIPOR2) ELISA Kit
BSKH60250,Human Angiotensinogen (AGT) ELISA Kit
BSKH60251,Human Angiotensin II Receptor 2 (AGTR2) ELISA Kit
BSKH60252,Human Activated Leukocyte Cell Adhesion Molecule (ALCAM) ELISA Kit
BSKH60253,Human (AngI) ELISA Kit
BSKH60254,Human Angiotensin II (AngII) ELISA Kit
BSKH60255,Human B-Cell Leukemia/Lymphoma 2 (Bcl2) ELISA Kit
BSKH60256,Human Bone Morphogenetic Protein 2 (BMP2) ELISA Kit
BSKH60257,Human Bone Morphogenetic Protein 4 (BMP4) ELISA Kit
BSKH60258,Human Bone Morphogenetic Protein Receptor 1A (BMPR1A) ELISA Kit
BSKH60259,Human Endothelin 1 (EDN1) ELISA Kit
BSKH60260,Human Epidermal Growth Factor Receptor (EGFR) ELISA Kit
BSKH60261,Human Fibroblast Growth Factor 23 (FGF23) ELISA Kit
BSKH60262,Human Fibroblast Growth Factor 4 (FGF4) ELISA Kit
BSKH60263,Human Fibroblast Growth Factor 5 (FGF5) ELISA Kit
BSKH60264,Human Fibroblast Growth Factor 6 (FGF6) ELISA Kit
BSKH60265,Human Fibroblast Growth Factor 9 (FGF9) ELISA Kit
BSKH60266,Human Interleukin 1 Delta (FIL1d) ELISA Kit
BSKH60267,Human Hepatoma Derived Growth Factor (HDGF) ELISA Kit
BSKH60268,Human Interferon Alpha 2 (IFNa2) ELISA Kit
BSKH60269,Human Interferon Alpha 4 (IFNa4) ELISA Kit
BSKH60270,Human Insulin Like Growth Factor 2 (IGF2) ELISA Kit
BSKH60271,Human Insulin Like Growth Factor Binding Protein 6 (IGFBP6) ELISA Kit
BSKH60272,Human Interleukin 11 (IL11) ELISA Kit
BSKH60273,Human Interleukin 12A (IL12A) ELISA Kit
BSKH60274,Human Interleukin 13 (IL13) ELISA Kit
BSKH60275,Human Interleukin 16 (IL16) ELISA Kit
BSKH60276,Human Interleukin 17 (IL17) ELISA Kit
BSKH60277,Human Interleukin 1 Alpha (IL1a) ELISA Kit
BSKH60278,Human Interleukin 1 Receptor Type I (IL1R1) ELISA Kit
BSKH60279,Human Interleukin 1 Receptor Type II (IL1R2) ELISA Kit
BSKH60280,Human Interleukin 1 Receptor Antagonist (IL1RA) ELISA Kit
BSKH60281,Human Interleukin 23 (IL23) ELISA Kit
BSKH60282,Human Interleukin 27 (IL27) ELISA Kit
BSKH60283,Human Interleukin 2 Receptor Beta (IL2Rb) ELISA Kit
BSKH60284,Human Interleukin 3 (IL3) ELISA Kit
BSKH60285,Human Interleukin 5 (IL5) ELISA Kit
BSKH60286,Human Interleukin 7 (IL7) ELISA Kit
BSKH60287,Human Interleukin 8 Receptor Alpha (IL8Ra) ELISA Kit
BSKH60288,Human Interleukin 9 (IL9) ELISA Kit
BSKH60289,Human B-Lymphocyte Activation Antigen B7-2 (LAB7-2) ELISA Kit
BSKH60290,Human Lymphocyte Function Associated Antigen 3 (LFA3) ELISA Kit
BSKH60291,Human Lymphotoxin Beta Receptor (LTbR) ELISA Kit
BSKH60292,Human Platelet Derived Growth Factor Subunit A (PDGFA) ELISA Kit
BSKH60293,Human Platelet Derived Growth Factor BB (PDGFBB) ELISA Kit
BSKH60294,Human Transforming Growth Factor Alpha (TGFa) ELISA Kit
BSKH60295,Human Transforming Growth Factor Beta 2 (TGFb2) ELISA Kit
BSKH60296,Human Transforming Growth Factor Beta Induced Protein (TGFbI) ELISA Kit
BSKH60297,Human Transforming Growth Factor Beta Receptor I (TGFbR1) ELISA Kit
BSKH60298,Human Tumor Necrosis Factor Beta (TNFb) ELISA Kit
BSKH60299,"Human Tumor Necrosis Factor Ligand Superfamily, Member 14 (TNFSF14) ELISA Kit"
BSKH60300,"Human Tumor Necrosis Factor Ligand Superfamily, Member 4 (TNFSF4) ELISA Kit"
BSKH60301,Human Vascular Endothelial Growth Factor B (VEGFB) ELISA Kit
BSKR60302,Rat C Reactive Protein (CRP) ELISA Kit
BSKR60303,Rat Follicle Stimulating Hormone (FSH) ELISA Kit
BSKR60304,Rat Macrophage Inflammatory Protein 1 Alpha (MIP1a) ELISA Kit
BSKR60305,Rat Tissue Inhibitors Of Metalloproteinase 2 (TIMP2) ELISA Kit
BSKR60306,Rat Transferrin (TRF) ELISA Kit
BSKM60307,Mouse Betacellulin (bTC) ELISA Kit
BSKL60308,General Estradiol (E2) ELISA Kit
BSKL60309,General Triiodothyronine (T3) ELISA Kit
BSKL60310,General Thyroxine (T4) ELISA Kit
BSKM60311,Mouse Adiponectin Receptor 1 (ADIPOR1) ELISA Kit
BSKM60312,Mouse Angiotensinogen (AGT) ELISA Kit
BSKM60313,Mouse Activated Leukocyte Cell Adhesion Molecule (ALCAM) ELISA Kit
BSKM60314,Mouse Angiotensin II (AngII) ELISA Kit
BSKM60315,Mouse Angiotensin I (AngI) ELISA Kit
BSKM60316,Mouse B-Cell Leukemia/Lymphoma 2 (Bcl2) ELISA Kit
BSKM60317,Mouse Brain Derived Neurotrophic Factor (BDNF) ELISA Kit
BSKM60318,Mouse Bone Morphogenetic Protein 2 (BMP2) ELISA Kit
BSKM60319,Mouse Bone Morphogenetic Protein 4 (BMP4) ELISA Kit
BSKM60320,Mouse Bone Morphogenetic Protein Receptor 1A (BMPR1A) ELISA Kit
BSKM60321,Mouse Connective Tissue Growth Factor (CTGF) ELISA Kit
BSKM60322,Mouse Endothelin 1 (EDN1) ELISA Kit
BSKM60323,Mouse Epidermal Growth Factor Receptor (EGFR) ELISA Kit
BSKM60324,Mouse Endocrine Gland Derived Vascular Endothelial Growth Factor (EG-VEGF) ELISA Kit
BSKM60325,"Mouse Fibroblast Growth Factor 1, Acidic (FGF1) ELISA Kit"
BSKM60326,Mouse Fibroblast Growth Factor 23 (FGF23) ELISA Kit
BSKM60327,"Mouse Fibroblast Growth Factor 2, Basic (FGF2) ELISA Kit"
BSKM60328,Mouse Fibroblast Growth Factor 4 (FGF4) ELISA Kit
BSKM60329,Mouse Fibroblast Growth Factor 6 (FGF6) ELISA Kit
BSKM60330,Mouse Fibroblast Growth Factor 7 (FGF7) ELISA Kit
BSKM60331,Mouse Fibroblast Growth Factor 9 (FGF9) ELISA Kit
BSKM60332,"Mouse Colony Stimulating Factor 2, Granulocyte Macrophage (GMCSF) ELISA Kit"
BSKM60333,Mouse Hepatoma Derived Growth Factor (HDGF) ELISA Kit
BSKM60334,Mouse Hepatocyte Growth Factor (HGF) ELISA Kit
BSKM60335,Mouse Interferon Beta (IFNb) ELISA Kit
BSKM60336,Mouse Insulin Like Growth Factor 2 (IGF2) ELISA Kit
BSKM60337,Mouse Insulin Like Growth Factor Binding Protein 1 (IGFBP1) ELISA Kit
BSKM60338,Mouse Insulin Like Growth Factor Binding Protein 2 (IGFBP2) ELISA Kit
BSKM60339,Mouse Insulin Like Growth Factor Binding Protein 4 (IGFBP4) ELISA Kit
BSKM60340,Mouse Insulin Like Growth Factor Binding Protein 6 (IGFBP6) ELISA Kit
BSKM60341,Mouse Interleukin 11 (IL11) ELISA Kit
BSKM60342,Mouse Interleukin 12A (IL12A) ELISA Kit
BSKH60343,Human Interleukin 12B (IL12B) ELISA Kit
BSKM60344,Mouse Interleukin 12B (IL12B) ELISA Kit
BSKM60345,Mouse Interleukin 13 (IL13) ELISA Kit
BSKM60346,Mouse Interleukin 15 (IL15) ELISA Kit
BSKM60347,Mouse Interleukin 16 (IL16) ELISA Kit
BSKM60348,Mouse Interleukin 17 (IL17) ELISA Kit
BSKM60349,Mouse Interleukin 18 (IL18) ELISA Kit
BSKM60350,Mouse Interleukin 1 Alpha (IL1a) ELISA Kit
BSKM60351,Mouse Interleukin 1 Receptor Type I (IL1R1) ELISA Kit
BSKM60352,Mouse Interleukin 1 Receptor Type II (IL1R2) ELISA Kit
BSKM60353,Mouse Interleukin 3 (IL3) ELISA Kit
BSKM60354,Mouse Interleukin 4 (IL4) ELISA Kit
BSKM60355,Mouse Interleukin 5 (IL5) ELISA Kit
BSKM60356,Mouse Interleukin 7 (IL7) ELISA Kit
BSKM60357,Mouse Interleukin 8 Receptor Alpha (IL8Ra) ELISA Kit
BSKM60358,Mouse Interleukin 9 (IL9) ELISA Kit
BSKM60359,Mouse Platelet Derived Growth Factor Subunit A (PDGFA) ELISA Kit
BSKM60360,Mouse Transforming Growth Factor Alpha (TGFa) ELISA Kit
BSKM60361,Mouse Transforming Growth Factor Beta 2 (TGFb2) ELISA Kit
BSKM60362,Mouse Transforming Growth Factor Beta Induced Protein (TGFbI) ELISA Kit
BSKM60363,Mouse Transforming Growth Factor Beta Receptor I (TGFbR1) ELISA Kit
BSKM60364,Mouse Tumor Necrosis Factor Beta (TNFb) ELISA Kit
BSKM60365,"Mouse Tumor Necrosis Factor Receptor Superfamily, Member 17 (TNFRSF17) ELISA Kit"
BSKM60366,"Mouse Tumor Necrosis Factor Ligand Superfamily, Member 14 (TNFSF14) ELISA Kit"
BSKM60367,Mouse Tumor Necrosis Factor Related Apoptosis Inducing Ligand (TRAIL) ELISA Kit
BSKM60368,Mouse Vascular Endothelial Growth Factor B (VEGFB) ELISA Kit
BSKM60369,Mouse Vascular Endothelial Growth Factor C (VEGFC) ELISA Kit
BSKM60370,Mouse Vascular Endothelial Growth Factor D (VEGFD) ELISA Kit
BSKH60371,Human Alpha-2-Macroglobulin (a2M) ELISA Kit
BSKH60372,Human Angiotensin I Converting Enzyme (ACE) ELISA Kit
BSKH60373,Human Adrenocorticotropic Hormone (ACTH) ELISA Kit
BSKH60374,Human Apolipoprotein A1 (APOA1) ELISA Kit
BSKH60375,Human Apolipoprotein B (APOB) ELISA Kit
BSKH60376,Human Apolipoprotein E (APOE) ELISA Kit
BSKH60377,Human Amphiregulin (AREG) ELISA Kit
BSKH60378,Human Brain Natriuretic Peptide (BNP) ELISA Kit
BSKH60379,Human Complement Component 5a (C5a) ELISA Kit
BSKH60380,Human Carbohydrate Antigen 19-9 (CA19-9) ELISA Kit
BSKH60381,Human Carbonic Anhydrase II (CA2) ELISA Kit
BSKH60382,Human Caspase 7 (CASP7) ELISA Kit
BSKH60383,Human Caspase 8 (CASP8) ELISA Kit
BSKH60384,Human Catalase (CAT) ELISA Kit
BSKH60385,Human Cluster Of Differentiation 8a (CD8a) ELISA Kit
BSKH60386,Human Calcitonin Gene Related Peptide (CGRP) ELISA Kit
BSKH60387,Human Ceruloplasmin (CP) ELISA Kit
BSKH60388,Human Calcitonin (CT) ELISA Kit
BSKH60389,Human D-Dimer (D2D) ELISA Kit
BSKH60390,Human Erythropoietin (EPO) ELISA Kit
BSKH60391,"Human Fatty Acid Binding Protein 2, Intestinal (FABP2) ELISA Kit"
BSKH60392,Human Factor Related Apoptosis (FAS) ELISA Kit
BSKH60393,Human Glucokinase (GCK) ELISA Kit
BSKH60394,Human Growth Differentiation Factor 5 (GDF5) ELISA Kit
BSKH60395,Human Glial Cell Line Derived Neurotrophic Factor (GDNF) ELISA Kit
BSKH60396,Human Gelsolin (GS) ELISA Kit
BSKH60397,Human Chorionic Gonadotropin (CG) ELISA Kit
BSKH60398,Human Hemopexin (HPX) ELISA Kit
BSKH60399,Human Heat Shock 70kDa Protein 8 (HSPA8) ELISA Kit
BSKH60400,Human Heat Shock Protein Beta 6 (HSPb6) ELISA Kit
BSKH60401,Human Kallikrein 1 (KLK1) ELISA Kit
BSKH60402,Human Kallikrein 7 (KLK7) ELISA Kit
BSKH60403,Human Mucin 1 (MUC1) ELISA Kit
BSKH60404,Human Neutrophil Gelatinase Associated Lipocalin (NGAL) ELISA Kit
BSKH60405,Human Neuropeptide S (NPS) ELISA Kit
BSKH60406,Human Osteoprotegerin (OPG) ELISA Kit
BSKH60407,Human Procalcitonin (PCT) ELISA Kit
BSKH60408,Human Platelet Factor 4 (PF4) ELISA Kit
BSKH60409,Human Plasminogen (Plg) ELISA Kit
BSKH60410,Human Phosphatase And Tensin Homolog (PTEN) ELISA Kit
BSKH60411,Human Resistin (RETN) ELISA Kit
BSKH60412,Human S100 Calcium Binding Protein A10 (S100A10) ELISA Kit
BSKH60413,Human S100 Calcium Binding Protein A11 (S100A11) ELISA Kit
BSKH60414,Human S100 Calcium Binding Protein A12 (S100A12) ELISA Kit
BSKH60415,Human S100 Calcium Binding Protein A6 (S100A6) ELISA Kit
BSKH60416,Human S100 Calcium Binding Protein A8 (S100A8) ELISA Kit
BSKH60417,Human S100 Calcium Binding Protein P (S100P) ELISA Kit
BSKH60418,"Human Troponin I Type 3, Cardiac (TNNI3) ELISA Kit"
BSKH60419,"Human Plasminogen Activator, Tissue (tPA) ELISA Kit"
BSKH60420,"Human Plasminogen Activator, Urokinase (uPA) ELISA Kit"
BSKH60421,Human Angiotensin II Receptor 1 (AGTR1) ELISA Kit
BSKH60422,Human Colony Stimulating Factor 2 Receptor Beta (CSF2Rb) ELISA Kit
BSKH60423,Human Cytotoxic T-Lymphocyte Associated Antigen 4 (CTLA4) ELISA Kit
BSKH60424,Human Epidermal Growth Factor Receptor 2 (EGFR2) ELISA Kit
BSKH60425,Human Fibroblast Growth Factor 10 (FGF10) ELISA Kit
BSKH60426,Human Fibroblast Growth Factor Receptor 1 (FGFR1) ELISA Kit
BSKH60427,Human Fibroblast Growth Factor Receptor 2 (FGFR2) ELISA Kit
BSKH60428,Human Fibroblast Growth Factor Receptor 3 (FGFR3) ELISA Kit
BSKH60429,Human Fibroblast Growth Factor Receptor 4 (FGFR4) ELISA Kit
BSKH60430,"Human Colony Stimulating Factor Receptor, Granulocyte (GCSFR) ELISA Kit"
